Tanggal;Banyak Retweet;Tweet;Terjemah
14/05/2021 02:59;0.0;tuhan tidak maling bansos;god doesn't steal social assistance
14/05/2021 03:00;0.0;paket bansos semayam orang 2 fakir miskin;social assistance packages for 2 poor people
14/05/2021 03:02;0.0;ingat mencuri bansos mayoritas minorotas serius;remember stealing social assistance for the majority of serious minorities
14/05/2021 03:03;0.0;kenyang makan duit bansos sih enak;it's good to eat the social assistance money
14/05/2021 03:03;1.0;orang miskin dijadiin slogan partai cilik kebalikjatah bansos untuk kesej;the poor are used as slogans for the little party behind the social assistance allowance for happiness
14/05/2021 03:04;0.0;suci hyena kelompok koruptor bansos teriak 2 pancasila aib;holy hyena, social assistance corrupt group shouting 2 pancasila disgrace
14/05/2021 03:05;0.0;suci hyena kelompok koruptor habitat bansos teriak 2 pancasila ai;holy hyena, corrupt group, habitat for social assistance, shouts 2 pancasila ai
14/05/2021 03:07;0.0;syetan semayam dalam tas bansos merek;satan is sitting in a brand social assistance bag
14/05/2021 03:08;0.0;bansos korupsi beh;social assistance for corruption
14/05/2021 03:12;1.0;dana bansos covid 19 71 miliar pakai foya beli mobil mewah;the 71 billion covid 19 social assistance fund is used to buy luxury cars
14/05/2021 03:14;0.0;terang dalam ingat gimana cilik simbol juang oposisi tapi kuasa sudah genggam licik makan cilikdana bansos satu;it's clear in remembering how the little symbol of the opposition struggles but the power has already been grasped by the cunning of eating the first social assistance fund
14/05/2021 03:19;4.0;fitur new dtks fitur  cusulan  csanggahan;new dtks feature rebuttal feature
14/05/2021 03:20;0.0;maksud teh;tea mean
14/05/2021 03:21;0.0;peluang daftar terima bansos;opportunity to register to receive social assistance
14/05/2021 03:22;3.0;tuhan gubuk miskin tapi bansos miskin embat sering omong buat selaras izin up tagar inastandswithpalestine slankpenipu;god, the hut is poor, but the social assistance is poor.
14/05/2021 03:23;0.0;mohon izin priseden pimpin jabat bansos blt umkm ambil surat perijinan tidak bantu kami masyarakat lagi karena masyarakat dapat bantu dari perintah;ask for permission from the president to lead the social assistance office blt umkm taking a permit does not help us the community anymore because the community can help from orders
14/05/2021 03:24;0.0;tuhan tidak bersemayan rumah mencuri bansos rakyat miskin;god doesn't live at home stealing social assistance for the poor
14/05/2021 03:28;0.0;karena tuhan bersemayan gubuk miskin pikir miskin urus tuhan bebas pakai dana bansos;because god resides in a poor hut thinking that the poor are taking care of god freely using social assistance funds
14/05/2021 03:30;1.0;list-nya tidak muat tanah bodong bansos pandemi;the list doesn't fit the pandemic social assistance fake land
14/05/2021 03:31;0.0;jatah orang miskin bansos besemayam kader;rations for the poor for social assistance with cadres
14/05/2021 03:31;0.0;semayam maling uang bansos;like a thief of social assistance money
14/05/2021 03:34;0.0;iya bu ajar korupsi bansos 2 miskin tega y bu habis pikir bu;yes, ma'am, teach corruption, social assistance 2, poor, have the heart, ma'am, you don't think so
14/05/2021 03:39;0.0;peluang daftar terima bansos  caranya;how to register to receive social assistance
14/05/2021 03:39;0.0;wajib bantu perintah putus mata rantai covid perintah bantu tka china lindung mega korupsi bansos terus kia wow gitu;obliged to help with the order to break the covid chain, the order to help chinese foreign workers protect mega corruption, social assistance continues, wow, is that so
14/05/2021 03:44;0.0;gilir bansos oknum serakah gercepnya ampun;turn the social assistance of greedy people, forgive me
14/05/2021 03:44;0.0;juliari koruptor bansos laknat partai;juliari bansos corruptors curse the party
14/05/2021 03:45;;jarah ude  ;loot ude 
14/05/2021 03:46;0.0;tuju dukung usut madam bansos banikonde;aim to support the investigation of the social assistance madam banikonde
14/05/2021 03:47;0.0;rumah madam bansos semayam beranijujurpecat;the house of madam of social assistance in semayam dares to be fired
14/05/2021 03:48;0.0;bansos jarah mensos komplot doa 2 2 aniaya manjur tangkap dampak dalam sidik 75 tidak lulus;bansos looted social men's prayer conspiracy 2 2 persecution was effective in capturing the impact in fingerprint 75 did not pass
14/05/2021 03:51;0.0;koruptor semayam bansos rakyat;corruptors like the people's social assistance
14/05/2021 03:52;0.0;korup bansos semayam serakah;corrupt social assistance, greedy
14/05/2021 03:55;0.0;ngomong gitu pdip juara koruptor maling bansos;say that pdip is the champion of corruption, theft of social assistance
14/05/2021 03:59;0.0;cek terima bansos tunai ktp;check, receive cash assistance, ktp
14/05/2021 03:59;0.0;selamat raya idul fitri 1442 h semoga fitri republik cinta waras hakiki korupsi bansos korupsi ekspor benur antigen palsu tka cina ott kepala daerah babi ngepet kpk negera game over;happy eid al-fitr 1442 h, may the fitri republic love sane love, corruption, social assistance, corruption, export of fried shrimp, fake antigen, chinese foreign workers, ott regional heads, pigs, kpk, countries, game over
14/05/2021 04:00;0.0;bansos anak lurah mas;village children's social assistance
14/05/2021 04:01;0.0;miskin tuhan gubuk seperti ingat harta istana jadi bansos miskin embat madam tidak tuhan istana;poor god of huts like remembering palace treasures so poor social assistance embat madam not palace god
14/05/2021 04:01;1.0;setan rampok dana bansos titip untuk miskin;the devil robs social assistance funds, leaves it for the poor
14/05/2021 04:02;0.0;banyak rampok bansos orang miskin;a lot of robbing the poor for social assistance
14/05/2021 04:03;0.0;tatkala bansos pnyambung hidup hari cilek diembatt boro 2 kamu ngutip larang tuhan;when social assistance is a way of life for the small day, it's diembatt boro 2 you quote god forbid
14/05/2021 04:05;0.0;atheis komunis ngomong tuhan akhirat saja percaya koruptor bansos tangkap tuh;communist atheists say that only god in the afterlife believes that social assistance corruptors catch them
14/05/2021 04:05;3.0;dana bansos untuk orang miskin colong;social assistance funds for the poor
14/05/2021 04:07;0.0;dana bansos miskin tilep;tilep poor social assistance funds
14/05/2021 04:09;0.0;nyata karno mak banteng jadi citra dalam praktik rakyat miskin manfaat pas milu hak seperti bansos korupsi;it's real because mak bull has become an image in the practice of the poor people who benefit from the milu rights such as the social assistance for corruption
14/05/2021 04:11;3.0;jatah bansos miskin gubuk embat mantan mensos dari pedeipeh mohon maaf lahir batin mon;allotment for social assistance for the poor, embat former social minister from pedeipeh, sorry to be born and inner heart, mon
14/05/2021 04:11;0.0;korupsi bansos kader;cadre social assistance corruption
14/05/2021 04:11;0.0;maksutnya tuhan mencuri bansos;i mean god stole social assistance
14/05/2021 04:14;0.0;kalau tagar pdijuaramaling misi pdi-p partai cilik lancar aksi maling bukti bansos untuk rakyat miskin gondol pdi-p;if the hashtag pdijuaramaling, the mission of the little party pdi-p, the thief's action is smooth, evidence of social assistance for the poor, the pdi-p steals
14/05/2021 04:14;0.0;praktek dana bansos korupsi kader partai banteng jijik;the practice of social assistance funds for corruption cadres of the bull party are disgusted
14/05/2021 04:16;0.0;korupsi bansos semayam mana;where is the social assistance corruption?
14/05/2021 04:17;0.0;cair trusss biar harga gelembung pasar sepi karena beli alih agen bansos dagang dapat dpt imbas paitnya kaya hanya broker;liquid truss so that the price of the market bubble is quiet because buying over a trade social assistance agent can get a bad effect like only a broker
14/05/2021 04:17;0.0;narasi cilikorang miskinfaktanya menteri curi bansosbupati jual-beli jabatanada;little narrative of the poor, the fact is that the minister stole social assistance, bupati, buying and selling positions
14/05/2021 04:23;0.0;alat miskin garong bansos maksud;poor tools rob social assistance
14/05/2021 04:24;0.0;bansos untuk orang miskin sumber proyek;social assistance for the poor source of the project
14/05/2021 04:30;0.0;tuhan semayam gubuk 2 miskin bu mega bansos u miskin dicuri anggota juliari batubara bendahara pdip;god is like hut 2 poor mrs. mega social assistance for poor u stolen members of juliari coal pdip treasurer
14/05/2021 04:31;0.0;gerombol partai bangsat sok nasihatin tau jatah bansos cilik hak dasar bangsat bangsa;bastard party gangs give advice, know the small social assistance quota, the basic rights of the nation's bastards
14/05/2021 04:31;0.0;tuhan uang jual miskin biar dapat uang ngrampok bansos;god, sell money to the poor so you can get money to rob social assistance
14/05/2021 04:33;0.0;dana bansos hasil korupsi sembunyi rumah serakah tidak tuhan;social assistance funds resulting from corruption hiding greedy houses are not god
14/05/2021 04:35;0.0;joss bisa update cb data korupsi bansos asabri bpjs e-ktapi ojonggateli;joss can update cb data corruption bansos asabri bpjs e-ktapi ojonggateli
14/05/2021 04:36;0.0;indonesia hitung politik erdogan sibuk korupsi bansos sih;indonesia counts erdogan's politics busy with social assistance corruption
14/05/2021 04:36;0.0;maksud koruptor gerombol kamu blok terus madam bansos ketangkep blok;what do you mean by gang criminals, you block, madam bansos gets caught
14/05/2021 04:37;0.0;bantu bansos miskin embat;help the poor embat
14/05/2021 04:39;0.0;tuhan semayam gubuk miskin mamak madam bansos hilang bahaya laten korupsi bhkan bansos ja tega korupsi trilyunan pula kaya miskin itu wrna dunia tapi kaya korupsi pntas miskin;god is like a poor hut, mamak madam, social assistance is gone. the latent danger of corruption, even social assistance, has the heart to corrupt, trillions of people are rich and poor, it's the color of the world, but rich in corruption deserves to be poor
14/05/2021 04:42;1.0;2 seperti indo banyak rakyat susah karena pandemi jabat korupsi bansos;2 like indonesia, many people are having a hard time because of the social assistance corruption pandemic
14/05/2021 04:45;0.0;kemarin curi duit bansos jadihak-nya kaum miskin golong 2 lawan tuhan mak banteng kenal;yesterday stole the social assistance money, so the rights of the poor are group 2 against god, the bull knows
14/05/2021 04:46;0.0;gaya kamu mak bansos orang miskin embat partai lu;your style is social assistance for the poor and your party
14/05/2021 04:49;0.0;ngomong dapat bantu bansos;say you can help social media
14/05/2021 04:51;0.0;mak banteng bilang tuhan semayam gubuk miskindan bansos semayam gubuk banteng banteng kayainastandswithpalestine inastandswithpalestine;mak bull says god is like a poor hut
14/05/2021 04:52;1.0;bansos jiwasraya lobsterinamalayaforpalestine;jiwasraya social assistance lobsterinamalayaforpalestine
14/05/2021 04:55;0.0;bansos asabri jiwasra blbi sumber waras dst kalau formula e bpk tidak korupsi;social assistance asabri jiwasra blbi sane source etc. if the e bpk formula is not corrupt
14/05/2021 05:00;0.0;bansos semayam tugas partai;social assistance is like a party task
14/05/2021 05:00;0.0;lapor bansos sasar new dtks rahasia lapor jamin;report social assistance targets new dtks secret report guarantee
14/05/2021 05:04;0.0;kadersnya korupsi hak miskin apa kabar madam bansos;the cadres are corrupt, the rights of the poor, how are you madam social assistance
14/05/2021 05:17;15.0;miskin hak korup dana bansos  4pesan lebaran megawati tuhan semayam gubuk miskin;poor, corrupt rights, social assistance funds 4 messages for eid megawati god is like a poor hut
14/05/2021 05:19;0.0;bansos semayam rumah madam serakah;social assistance is like the greedy madam's house
14/05/2021 05:35;0.0;kalau korupsi bansos jiwasraya asabri internal;if corruption is internal social assistance soulsraya asabri
14/05/2021 05:36;0.0;ente ngapain ngurusin duit anak urus dana bansos embat garong partai juara korupsi kuasa rezim;what are you doing with your child's money, managing social assistance funds, and trying to rob the party that wins the regime's corruption
14/05/2021 05:38;0.0;bansos dikorupsihak miskin kebiri;social assistance is corrupted by the castration poor
14/05/2021 05:38;0.0;malas bicara dinasti berani pemda dki harun masiku korupsi bansos korupsi kkp pilkada pandemi mingkem males gw;lazy to talk dynasty, dki district government, harun masiku, corruption, social assistance, corruption, kkp, election, pandemic, mingkem, lazy i
14/05/2021 05:39;0.0;lanjut ektapi hambalang balik dana blbi bansos formula e usut tuntas tidak tebang pilih;continued ektap but blocked back the blbi social assistance funds, the formula e was thoroughly investigated, not selective
14/05/2021 05:39;0.0;lha jatah bansos miskin ngambil;you know, the poor social assistance quota takes
14/05/2021 05:41;0.0;jatah bansos untuk miskin ngambil;social assistance quota for the poor
14/05/2021 05:43;0.0;dendam samoai koruptor bansos buat data fiktip 21 jt terima bansos;revenge for social assistance corruptors for fictitious data 21 million receive social assistance
14/05/2021 05:44;0.0;bansos rakyat kismin saja embat;only kismin people's social assistance
14/05/2021 05:45;0.0;nanti ditilep lagi seperti dana bansos;later ditilep again like social assistance funds
14/05/2021 05:47;0.0;daftar terima blt umkm online tahap 2 3 pnm mekar hp umkm pnmmekar hamasisrael kpkrasacukong indomaret covid 19 bansos;register for blt umkm online stage 2 3 pnm blooming mobile umkm pnmmekar hamasisrael kpkrasacukong indomaret covid 19 social assistance
14/05/2021 05:47;0.0;madam bansos ternak koruptor bikin tuhan murka;madam bansos corrupt cattle make god angry
14/05/2021 05:47;0.0;tuju usut bansos tangkap harun masiku benur;go to investigate social assistance and catch harun masiku fry
14/05/2021 05:48;0.0;bicara cuman rakyat kenyataanya maling dana bansos;just talking about the people, in fact they steal social assistance funds
14/05/2021 05:48;0.0;madam tuhan bersemayan gubuk 2 miskin orang miskin dam kamu tau maling duit bansos kemarin semayannya madam tar saya kerok bulu ketek saya tau ketek saya miskin ooo pantes congor kamu bau ketek dam;madam god resides in hut 2 poor poor people dam you know stealing social assistance money yesterday, madam tar, i scraped my armpit hairs i know my armpit is poor ooo pantes congor you smell armpit
14/05/2021 05:49;0.0;sudah tau tuhan maha kaya bansos untuk orang miskin korupsi;already know that god is rich in social assistance for the poor and corrupt
14/05/2021 05:51;0.0;curi jatah bansos miskin westandwithgaza;steal the social assistance quota for the poor westandwithgaza
14/05/2021 05:52;0.0;melarat hanya tameng gae gacu tok gilir dapat jabat jatah bansos rakyat miskin tilep gombal mukiyo;poverty is only a shield gae gacu tok turn to get a share of social assistance for the poor, tilep rag mukiyo
14/05/2021 05:54;0.0;dana bansos tilep;tilep social assistance fund
14/05/2021 05:54;0.0;miskin hati jatah rakyat embat dengan tameng proyek ada bansos;poor heart, embat people share with project shield there is social assistance
14/05/2021 05:57;0.0;lindung koruptor  sementara twk ngadi 2 singkir sudah tangan kelas berat ektapi bansos isu yahut dendam ketua karena periksa;protect corruptors while twk ngadi 2 get out of the hands of the heavyweights, but social assistance issues are facing the head's revenge because of the investigation
14/05/2021 05:57;0.0;nicknamenya madam bansos semayam 2 situ;her nickname is madam bansos in the 2nd place
14/05/2021 06:02;0.0;nenek ambil jatah bansos miskin;grandma takes social assistance for the poor
14/05/2021 06:03;0.0;tenaga kesehatan covid saja php bahagia masih kemplang hak gilir ratus miliar duit bansos garong adem 2 saja kemarin taipan jual online guyur 400 miliar mk free ongkir mhn komentar menkeu;health workers just php happy php still kemplang rotation rights hundreds of billions social assistance money just chilling 2 yesterday tycoon selling online splashed 400 billion mk free shipping please comment on the minister of finance
14/05/2021 06:03;0.0;rakyat miskin terus biar tuhan bersemanyam gubuk 2 orang miskin dana bansos biar korup 2 dalam hati mak lampir;poor people continue to let god live in a hut 2 poor people donate social assistance funds so that they are corrupt 2 in the heart of mak attached
14/05/2021 06:05;0.0;jatah bansos miskin curi anak buah bu takut tuhan yaa;rations for social assistance for the poor steal the subordinates, madam, fear god, okay?
14/05/2021 06:06;0.0;bansos semayam markas pdip;social assistance at the headquarters of pdip
14/05/2021 06:06;0.0;kalau bansos kantong madam;if the social assistance is madam's pocket
14/05/2021 06:06;0.0;setor madam bansos;madam bansos deposit
14/05/2021 06:07;1.0;aamiin ya mujibb qobiltu bansos km50 inastandswithpalestine;thank you mujibb qobiltu social assistance km50 inastandswithpalestine
14/05/2021 06:09;0.0;abis sama bansos;finished with social assistance
14/05/2021 06:15;0.0;bansos obyek bancak;bancak object social assistance
14/05/2021 06:15;0.0;dana bansos koruptor semayam partey;social assistance fund for corruptors in semaym partey
14/05/2021 06:15;;semoga pegawai 2 wawasan bangsa profesional tisik oknum 2 libat korupsi 2 bankcentury blbi ektapi bansos 2 nazaruddin ungkap  ;i hope employees 2 have professional insight into the nation and look for elements 2 involved in corruption 2 bankcentury blbi ektapi bansos 2 nazaruddin said 
14/05/2021 06:15;0.0;pikir kelompok bansos embat;think the social assistance group embat
14/05/2021 06:16;0.0;yah pelihara miskin biar bancak bansos alir teruss;well, take care of the poor so that the social assistance will continue to flow
14/05/2021 06:18;;bangun sudah madam bansos  ;wake up madam bansos 
14/05/2021 06:19;0.0;kalau 1 juni gimana minggu dapat antri full antri bansos gt gatau;if it's june 1, how about sunday, you get a full queue for social assistance, gt i don't know
14/05/2021 06:19;1.0;woiii beda dengan sini ketika rakyat derita eh duit bansos embat dan kamu diam saja koplak kamu  inastandswithpalestine inastandswithpalestine;wow, it's different from here when the people suffer, eh, the social assistance money is embattled and you just keep quiet, you're inastandswithpalestine, inastandswithpalestine
14/05/2021 06:20;0.0;koruptor bansos semayam kandang banteng;social assistance corruptors are like a bull cage
14/05/2021 06:21;3.0;ngomongin muskin 1 badan gembrot tanda makmur 2 duit bansos rakyat miskin d;talking about poor people, 1 fat body, a sign of prosperity 2 money for social assistance for the poor
14/05/2021 06:22;0.0;dah gitu jatah bansos embat  nasib miskin negeri tragis;that's the allotment of social assistance for the poor fate of a tragic country
14/05/2021 06:22;0.0;geng bansos tuhan;god's social assistance gang
14/05/2021 06:23;3.0;jatah bansos miskin gubuk embat mantan mensos dari pedeipeh mohon maaf l;social assistance allowance for the poor, former social minister from pedeipeh, i'm sorry l
14/05/2021 06:23;0.0;kalau  csia miskin goblog cokot tah bansos;if csia is poor, it's stupid, it's social assistance
14/05/2021 06:23;0.0;lha bansos garong;lha social assistance is illegal
14/05/2021 06:23;0.0;salam kantong bansos bu;greetings, social assistance bag, ma'am
14/05/2021 06:24;0.0;partai miskin kerja kemplang duit rakyat miskin bansos;the poor party works for the poor people's money for social assistance
14/05/2021 06:24;3.0;tuhan gubuk miskin tapi bansos miskin embat sering omong buat;god, the hut is poor but the social assistance is poor, you often talk about it
14/05/2021 06:26;0.0;kantong juliari peter maling bansos;peter thief bansos juliari bag
14/05/2021 06:26;0.0;maksud rumah ikut ngatur-ngatur bansos;the purpose of the house is to take care of the social assistance
14/05/2021 06:27;0.0;aku kamu coba search google partai korup maling dana bansos partai tangkap kpk kader partai;i, you try to search google, the corrupt party, the thief of the social assistance funds, the party, arrests the party cadre kpk
14/05/2021 06:27;0.0;ngantri bansos covid kak;waiting for the covid assistance sis
14/05/2021 06:27;0.0;oi bansos balikin jangan ditilep;oi social assistance come back, don't be typed
14/05/2021 06:29;0.0;miskin dana bansos;poor social assistance funds
14/05/2021 06:30;0.0;bansos miskin korupsi anak buah;social assistance for the poor corruption of the subordinates
14/05/2021 06:30;0.0;tidak bayang kalau masiku liar jabat menteri;i can't imagine if i'm still wild as a minister
14/05/2021 06:33;6.0;bansos nyampe orang miskin tani tuhan bansos-nya pake untuk partai https;social assistance arrives, the poor farmer, god, the social assistance is used for the party https
14/05/2021 06:33;1.0;bawa bawa tuhan bawa bawa miskin bansos itu korup sama juliari;bring god, bring the poor, social assistance is corrupt and juliari
14/05/2021 06:34;1.0;bansos tunai 300 ribu bansos pkh cair mei 2021 cek terima;cash assistance 300 thousand pkh social assistance disbursed in may 2021 check received
14/05/2021 06:34;0.0;korufsi dana bansos gimana;how is the corruption of the social assistance fund?
14/05/2021 06:36;0.0;pantesan bansos korupsi kader rakyat miskin shg tuhan rumah bilik;it is appropriate for social assistance for corruption cadres of the poor so that god is a cubicle
14/05/2021 06:39;0.0;banding busro vs ngabalin ngabalin vs yuliarti bansos;busro vs ngabalin ngabalin vs yuliarti bansos comparison
14/05/2021 06:40;0.0;hahaha mabok bipang halowww harun masiku sehat 2 transfer madam bansos;hahaha drunk bipang hellowww harun masiku healthy 2 transfer madam bansos
14/05/2021 06:40;0.0;mereka ajar dengan koruptor bansos gimana manipulasi;they teach social assistance corruptors how to manipulate
14/05/2021 06:44;0.0;kabar bansos;social assistance news
14/05/2021 06:46;0.0;miskin bansos korupsi;poor social assistance corruption
14/05/2021 06:49;0.0;pantesan korupsi tuhan gubuk 2 orang seperti madam bansos;god's corruption deserves a hut of 2 people like madam bansos
14/05/2021 06:55;14.0;embat dana bansos tangkap proses hukum;embat social assistance funds arrest legal process
14/05/2021 06:55;0.0;juara korupsi keleeess halo harun masiku halo madam bansos;keleeess corruption champion hello harun masiku hello madam bansos
14/05/2021 06:55;0.0;radikal-radikul dongeng cipta garongsedangkan garong bansos;fairy tale radicals are created garong, while social assistance is illegal
14/05/2021 06:56;2.0;korupsi kait sehat alkes bansos masa fake pandemi hukum sidik integritas pecat dunia main senda gurau;corruption, healthy hooks, medical aids, social assistance during the fake pandemic, law, fingerprints, integrity, fires the world for fun
14/05/2021 06:57;0.0;seperti kaum kamu duit bansos embat bong;like your people, embat bong social assistance money
14/05/2021 07:03;0.0;bansos semayam gubuk orang miskin embat grup partai sendiri bisa judul sinetron azab indosiar madam;social assistance in the hut of the poor, four party groups themselves can title the soap opera doomsday, madam, indosiar
14/05/2021 07:04;0.0;halaaah cilik maksud iya sebagai vote getter pendulamg suara gilir bansos cilik gimana mak e;halaah little, i mean, yes, as a vote getter, the voice of the little social assistance rotates, what do you do, mak e
14/05/2021 07:05;0.0;satu tuduh kamu milik data akurat dan lapor acountable madam bansos;one accusation that you belong to accurate data and report to madam bansos accountable
14/05/2021 07:07;0.0;om suruh budi kecap bawain bansos tuk mak nya;om told budi soy sauce to bring social assistance for his mother
14/05/2021 07:09;1.0;pandemi korupsi nyata korupsi bansos 21 juta data ganda;real corruption pandemic corruption of social assistance 21 million double data
14/05/2021 07:11;0.0;andal kadrun harum masiku bansos tok;reliable kadrun fragrant masiku social assistance tok
14/05/2021 07:12;0.0;ingat bansos covid mengjancurkan pasar pasca lebaran;remember that the covid assistance has destroyed the market after eid
14/05/2021 07:13;0.0;tau 2 2 korupsi bansos rakyat miskin embat juliari batubara menteri jokowi bilang tidak visi misi menteri visi misi presiden korupsi imam nahrowi korupsi bansos pilih menteri haaah;tau 2 2 corruption of social assistance for poor people embat juliari coal minister jokowi says no vision mission minister vision mission president corruption imam nahrowi corruption social assistance vote minister haaah
14/05/2021 07:14;0.0;masyarakat daftar terima bansos lapor new dtks;people register to receive social assistance report new dtks
14/05/2021 07:17;0.0;bendahara partai mencuri uang milyaran bansos dasar makhluk hina cuihhh;the party treasurer stole billions of social assistance money, you despicable creature, cuihhh
14/05/2021 07:17;0.0;celaka massa tolol tidak teriak bansos embat anak buah bu;woe to the stupid mob, don't shout for social assistance, ma'am, ma'am
14/05/2021 07:17;0.0;miskin bansos rampok anggota;poor social assistance rob members
14/05/2021 07:18;0.0;koruptor bansos di hukum mati tuju tdk;social assistance corruptors are sentenced to death or not
14/05/2021 07:19;0.0;sesuai pidato politiktuhan semayam gubuk miskin bansos;according to the speech of god's politicians like a poor hut for social assistance
14/05/2021 07:20;0.0;2 untung pake dana bansos;2 profit using social assistance funds
14/05/2021 07:20;0.0;kentit bansos;social support fart
14/05/2021 07:25;0.0;dana bansos tilep rela dukung suara sampai 20;tilep social assistance funds are willing to support up to 20 votes
