Tanggal;Banyak Retweet;Tweet;Terjemah
13/05/2021 00:06;0.0;bayang no masiku mas e dadi bansos sg sasar;shadow no masiku mas e dadi social assistance sg targeted
13/05/2021 00:08;0.0;ngutang 6000t dapat bansos mie instan;debt 6000t get instant noodle social assistance
13/05/2021 00:21;0.0;pemberian bansos bukti hadir negara masyarakat dukung kebaikan untuk nkri dukung kebaikan untuk nkri;the provision of social assistance is evidence of the presence of the state, the community supports goodness for homeland, supports goodness for homeland
13/05/2021 00:21;0.0;dukung kebaikan untuk nkri  9pemberian bansos bukti hadir negara masyarakat dukung kebaikan untuk nkri;support goodness for homeland 9 the provision of social assistance proof of the presence of the state people support goodness for homeland
13/05/2021 00:30;0.0;bansos bukti dukung kebaikan untuk nkri;social assistance is evidence to support goodness for nkri
13/05/2021 00:45;0.0;rakyat indonesia maaf korupsi dana bansos;indonesian people sorry for corruption in social assistance funds
13/05/2021 01:05;0.0;bansos tangan di proses beda subsidi uap alih 2 pihak ambil untung lingkar mafia migas lindung legalitas bijak dalam hadap krisis;social assistance is in a different process, steam subsidies are transferred by 2 parties to take advantage of the oil and gas mafia circle to protect legality wisely in the face of crisis
13/05/2021 01:08;0.0;andre nainggolan non muslim lagi nanganin bansos kamu bilang jahiliyah firli langgar kode etik berat henti kpk lo;andre nainggolan non-muslims are still handling social assistance you say jahiliyah firli violated the code of ethics seriously stop kpk lo
13/05/2021 01:15;0.0;bansos dana insentif tenaga kesehatan sukarelawan tidak mafia dana covid 19 ganas rampok anggar;social assistance funds, incentives for health workers, volunteers, not mafia, funds for covid 19, viciously rob fencing
13/05/2021 01:19;2.0;korupsi papua adlh karena nkri koruptif asai oligarki bansos jkt embat lg;papua's corruption is due to the corruption of the republic of indonesia, the social assistance oligarchy, in late again
13/05/2021 02:01;0.0;dukung kebaikan untuk nkri beri bansos bukti hadir;support goodness for homeland, give social assistance, proof of attendance
13/05/2021 02:03;0.0;pusing ngajuin bansos lurah turun rw saya inisiatif duit kantong agama kaya misquen beliau rata kali tidak heran sulit ganti;i'm dizzy applying for the sub-district social assistance to go down to rw, i have the initiative to make money from religious pockets, rich in misquen, he's usually not surprised that it's hard to replace
13/05/2021 02:07;0.0;kalau kpk hebat sulit tangkap harun masiku madam bansos tebang pilih;if kpk is great it's hard to catch harun masiku madam bansos selectively
13/05/2021 02:08;1.0;bela bansos asabri bpjs pada sorak sorak karena sbntr lagi mereka dpt;defend the social assistance asabri bpjs to cheers because soon they will get it
13/05/2021 02:14;0.0;bagus bansos biar embat ekonomi biar cepet roket biar perintah salahin eeehh;it's good that the social assistance will slow down the economy so that the rocket will speed up so that the orders will be blamed eeehh
13/05/2021 02:15;0.0;bhabinkamtibmas polsek sawah serah bansos beras dampak covid 19;bhabinkamtibmas rice field police hand over rice social assistance due to covid 19
13/05/2021 02:20;0.0;pempus bansos;social assistance
13/05/2021 02:25;2.0;bayangin e-ktapi jiwasraya bansos jual beli jabat bilang receh mentang ketangkep banyak pudidi;imagine e-ktapi jiwasraya bansos buying and selling shackles said small change because they caught a lot of money
13/05/2021 02:28;2.0;bayangin e-ktapi jiwasraya bansos jual beli jabat bilang receh tan;imagine e-ktapi jiwasraya bansos buying and selling shackles say change tan
13/05/2021 02:31;0.0;tuju bansos 2 peti es minimal abu 2 kanmakanya orang jujur singkir ganti sama orang 2 jilat cinta dunia seperti  ngesilin ngebolin;go for social assistance 2 ice chests, at least 2 ash, that's why honest people get out of the way and replace people with 2 people who love the world like playing a ball
13/05/2021 02:33;0.0;woi balikin itu duit korupsi bansos duit tiket jalan 2 amerika pakai sorban tutup pikir busuk;wow, return it money for corruption, social assistance, money for america's 2nd road ticket using a turban, close it thinks it's rotten
13/05/2021 02:51;0.0;negara hutang dana salur bansos uang karaoke anak 2 keras tahun bayar hutang biaya hibur pns kroni;state debt, funds, social assistance channel, karaoke money, children 2 years old, paying debts, entertainment costs, civil servants, cronies
13/05/2021 02:54;2.0;gimana yaaa sih saya pro covid kesini bongkar gimana bobrok d;how come i'm pro covid here, how is it dilapidated?
13/05/2021 03:03;0.0;bansos muk g;social assistance muk g
13/05/2021 03:10;0.0;bela miskin dana bansos embat;defend the poor with social assistance funds
13/05/2021 03:11;0.0;kalau koruptor bansos koruptor entar min;if corrupt, social assistance is corrupt, then min
13/05/2021 03:11;0.0;partai gadungan kalau ngaku juang cilik tapi maling duit bansos;fake party that claims to be fighting for a little bit but steals social assistance money
13/05/2021 03:12;0.0;emang e ktapi bansos jiwasraya pesan bani bipang ngomong isi;it's true, but the social assistance of jiwasraya ordered bani bipang to talk about the contents
13/05/2021 03:13;0.0;maaf kpk bersih aman korupsi bansos;sorry kpk clean safe corruption bansos
13/05/2021 03:19;0.0;kader korupsi dana bansos;social assistance fund corruption cadres
13/05/2021 03:30;0.0;seperti ngene ngurus negoro opo iki dagel maca berita iki semoga waras dadi edan kabeh iki rezim wes tenan ndablek semoga benar dadi tidak benar semoga tidak benar dadi benar pejabate ora ana isine bansos ditelen kpk paten mbuh iki mau dadi seperti  opo indonesia;like taking care of negoro opo iki dagel read this news hopefully sane dadi is crazy kabeh iki wes regime is really ndablek hopefully it's true dadi is not right hopefully it's not true dadi is right official ora isine bansos is taken by kpk patent heals this want dadi like opo indonesia
13/05/2021 03:35;1.0;bansos bongkar akar guncang dunia salahsatunya pegawai kpk kondisi denga;social assistance dismantles the roots of shaking the world, one of which is the kpk employee in a condition with
13/05/2021 03:37;0.0;ooo ya begitu juga ngomong panggung catat demokrasi non aktif lagi meriksaq benur lobster bansos;ooo, yes, that's the same as saying that the stage for recording democracy is not active anymore. checking out the social assistance lobster fry
13/05/2021 03:46;0.0;adil kembali dana bansos tilep madam;just return the tilep madam social assistance funds
13/05/2021 03:50;0.0;organik unorganik beli bansos eh;organic unorganic buy social assistance eh
13/05/2021 03:54;0.0;sih kalau partai monyong putih ujung ujung dagang nasionalis cilik ujung ujung jual daulat negara korupsi bansos cilik;what if the monyong putih party is the end of the small nationalist trade, the end of the sale of state sovereignty is the corruption of the little social assistance
13/05/2021 04:02;0.0;hahaha bansos embat incentive embat;hahaha embat social assistance embat incentive
13/05/2021 04:05;0.0;madam bansos aksi;madam social assistance action
13/05/2021 04:07;0.0;abisnye anak bahasanye ade saja bang afzil pake hampers tinggal bilang bansos saja ribet wkwminal aidin wal faizin ma prend;after all, the language is okay, bro, afzil uses hampers, all you have to do is say social assistance is complicated, wkwminal aidin wal faizin ma prend
13/05/2021 04:17;0.0;dapet sarden bansos nih;get sardines for social assistance
13/05/2021 04:17;0.0;maklum bang banyak makan babi panggang sarden bansos tuh;you know, you eat a lot of roasted pork, sardines, social assistance
13/05/2021 04:17;12.0;teman lieus sungkharisma bansos gang sempit tamansari wagub dki mudah;friend, lieus sungkharisma, social assistance, the narrow alley of tamansari, deputy governor of dki jakarta, is easy
13/05/2021 04:30;15.0;selamatlebaranjagakesehatanbanyak tertawa atur anjur perintah dalam tangan kovid 19 kalau bansos berangkat pagi gilir kovid nomor salah perintah cool banget sudah warganegara model;happy lebaran, take care of your health, laugh a lot, arrange orders in the hands of covid 19, if the social assistance leaves in the morning, it's the covid-19 shift, the number is wrong, the order is really cool, you're already a model citizen
13/05/2021 04:35;15.0;selamatlebaranjagakesehatanbanyak tertawa atur anjur perintah dalam tangan kovid 19 klo;happy lebaran, keep healthy, laugh a lot, put orders in the hands of covid 19 if you are
13/05/2021 04:44;0.0;lelet proses bansos;slow process of social assistance
13/05/2021 04:50;0.0;bani bipang cocuk bangat smua halal bansos ektapi asabri jiwasraya bpjs embat smua;bani bipang is very compatible with all halal social assistance, ektapi, asabri jiwasraya, bpjs, all of them
13/05/2021 04:51;0.0;sopir kondektur bus akap sehat daja sehat larang mudik rejeki stop tidak insentif setop kuasa kas negara kocar-kacir bansos saja korup;bus conductor driver who says healthy and healthy, prohibits going home, fortune, stops, no incentives, stops the power of the state treasury to be messy, social assistance is corrupt
13/05/2021 04:52;0.0;makan haram maksud steak daging sapi beli hasil korupsi bansos;eating haram means beef steak buying the results of social assistance corruption
13/05/2021 05:05;1.0;isu datang tka cina isu korup bansos isu bong fakta;the issue came from china's tka, the issue of corruption, social assistance, the issue of factual bongs
13/05/2021 05:09;0.0;hambalang blbi bansos formula lebih anggar bnyak;hamper blbi social assistance, the formula is more budgetary
13/05/2021 05:14;0.0;cari muka luu coba bicara tentang kpk berani gaak madam bansos putra lurah ancam demi adil puan setop izin wna;look for face luu try to talk about kpk dare or not madam bansos the son of the village head threatens to be fair, madam, stop foreign permission
13/05/2021 05:17;0.0;koruptor masyarakat susah ekonomi tega korupsi bansos masyarakat koruptor buruk hukum mati follow;corrupt people in economic hardship have the heart to corrupt social assistance for bad corrupt people the death penalty follow
13/05/2021 05:44;2.0;ngumpulin duik kencreng lampu merah lapak onlen bansos dunmay lapak bitcoin;collect duik kencreng red light online social assistance stall dunmay bitcoin stall
13/05/2021 05:55;0.0;kamu dana bansos sikat maling mingkem tai lu;you fund social assistance to brush the thief away tai lu
13/05/2021 05:59;2.0;dipromoin makan haram bipang raya lebaran mau bikin gaduh biar lupa korupsi dana bansos tka;being promoted to eat haram bipang raya eid wants to make a noise so you forget about corruption in the social assistance fund tka
13/05/2021 05:59;0.0;perintah anggar bayar buzzerrp seperti kamu sih duit bansos;fencing orders pay buzzerrp like you, social assistance money
13/05/2021 06:14;0.0;dana bansos korup diam;corrupt social assistance funds are silent
13/05/2021 06:15;0.0;bansos tunai 300 ribu cair mei 2021 cek terima indonesia;cash assistance 300 thousand disbursed in may 2021 check received indonesia
13/05/2021 06:17;0.0;bulls rampok dana bansos wkwkwk;bulls rob social assistance funds wkwkwk
13/05/2021 06:18;3.0;maafkan kamu nonaktifin 75 pegawai kpk bilang konflik israel palestina batas konflik agama nerobos jalur sepeda korupsi dana bansos bbrapa org;sorry for deactivating 75 kpk employees said the conflict israel palestine religious conflict boundary broke through the bicycle lane corruption of social assistance funds several people
13/05/2021 06:23;3.0;maafkan kamu nonaktifin 75 pegawai kpk bilang konflik israel d;sorry you disabled 75 kpk employees said the israel conflict d
13/05/2021 06:29;0.0;uang bansos;social assistance money
13/05/2021 06:34;0.0;analogi anak disemangatin sangka dana bansos teman 2 mengerubungin plis jangan bawa nama aku sianak bilang tenang celah korup indonesia ajar salah aku heuheu;children's analogy is encouraged, thinking that the social assistance funds from friends 2 are swarming around. please don't take my name. sianak says calm down, indonesia's corrupt loophole, teach me wrong
13/05/2021 06:39;0.0;koruptor bansos bunuh rakyat miskin iya rakyat sudah paham sampai rumah pada rapid rumah sakit;social assistance corruptors kill poor people, yes, people understand that they arrive home at the rapid hospital
13/05/2021 06:40;0.0;komen banyak bani bipang doyan bansos panggang;many comments from bipang people like grilled social assistance
13/05/2021 06:41;0.0;nyediain khong guan bekas bansos suaranyaaa;provide khong guan, the former voice assistance
13/05/2021 06:43;1.0;kepala isi otak pakai mikir bantai dipalestina saudara muslim hak muslim ambil bela urus miskin negara indonesia karena perintah abai karena dikelolah rakus serakah dana bansos mereka embat;head, fill the brain, use thinking, massacre in palestine, muslim brothers, muslim rights, take care of the poor in indonesia because orders are ignored because they are managed by greed, they don't get social assistance funds
13/05/2021 06:46;0.0;rusuh ngrampok duit bansos untuk rakyat rusuh ngejual daulat nkri kpada aseng paham kamu mbok dhe cebong;rioters rob social assistance money for the people, riots sell homeland sovereignty to aseng, understand that you are mbok dhe cebong
13/05/2021 06:58;0.0;ditileb seperti duit bansos;ditileb like social assistance money
13/05/2021 06:59;0.0;otak kamu sih cacing akibat doyan makan bipang kamu faham 75 pecat garap 2 satu bansos;your brain is a worm because you like to eat bipang you understand
13/05/2021 07:00;0.0;pancasilais korupsi bansos;social assistance corruption
13/05/2021 07:23;0.0;urus kamu juga ngaku suci benar kaffah tidak langgar hukum atur sah daripada ngaku pancasilais nasionalis eh bansos embat;take care of you, claiming to be holy, right, kaffah doesn't violate the law, regulates it, rather than claiming to be a nationalist pancasila eh social assistance embat
13/05/2021 07:28;3.0;think  bp munarman kriminalisasi rezim tutup km50 tendang bp novel rezim tutup e-ktapi skandal kpu dengan hilang harun masiku korupsi bansos sandiwara rezim takut kuak hebat lurah;think bp munarman criminalizes regime closes km50 kicks bp novel regime closes e-kbut kpu scandal with missing harun masiku corruption, social assistance plays, regime fears kuak great lurah
13/05/2021 07:31;3.0;think  bp munarman kriminalisasi rezim tutup km50 tendang bp novel rezim ingin;think bp munarman criminalize regime close km50 kick bp novel regime want
13/05/2021 07:33;0.0;maaf israel koruptor dana bansos skip;sorry israel corrupts social assistance funds skip
13/05/2021 07:50;0.0;korupsi bansos tidak bunuh perlahan warga;social assistance corruption doesn't kill people slowly
13/05/2021 08:11;0.0;e ktapi disbut bansos bebas wara wiri sakti;e kbut it's called social assistance free of wara wiri magic
13/05/2021 08:12;0.0;2 harap bansos sok ngurusi negara ngurus rumah tangga blum;2 i hope that social assistance is pretentious about taking care of the country, taking care of the household, not yet
13/05/2021 08:38;0.0;tukang martabak toping bansos kalau pimpin;martabak toping the social assistance if you lead
13/05/2021 08:43;0.0;slank temenya partai bansos slankpenipu;slank is the theme of the social assistance party, slank is a fraud
13/05/2021 08:56;0.0;gimana ini lanjut hukum korupsi bansos cc hukum mati mantan mensos julia;how about this, the law for corruption in the social assistance cc is executed by ex-social minister julia
13/05/2021 09:11;2.0;ngumpulin duik kencreng lampu merah lapak onlen bansos dunmay;collect duik kencreng red light stall online social assistance dunmay
13/05/2021 09:17;0.0;aroma balas dendam nuansa bela koruptor kakap alir dana bansos madam;the smell of revenge, the nuances of defending corruptors, snapper, madam's social assistance funds flow
13/05/2021 09:31;0.0;cek terima bansos tunai 300 ribu akses cair mei 2021;check, receive 300 thousand cash assistance, liquid access in may 2021
13/05/2021 09:33;0.0;jual minoritas norak kamu boy lebaran sok sok nyulut api lagi minoritas nguasain harta negara demen korup tri nilep bansos minoritas kabar boy ilang berita telorasin biji tendang;selling the tacky minority, you boy lebaran pretends to start the fire again, the minority controls state property, corrupt dement, tri nilep, social assistance, minority news, boy is missing, telorasin news kicks in
13/05/2021 09:43;0.0;cie kejang kejang gara gara 75 non aktif gajah teriak teriak bansos bansos kejang kejang tidak bansos;cie convulsions convulsions because of 75 inactive elephants shouting social assistance social assistance seizures convulsions not social assistance
13/05/2021 09:47;0.0;laah bandit sih itu pdip partai juara korupsi usung presiden presiden pilih menteri itu juli bansos menteri laut menpora 2 periode boro 2 ekonomi roket nyungsep pimpin bodoh lahir akibat pilih bodoh;it's a bandit, pdip, the corruption champion party, supports the president, elects the minister, july, social assistance, minister of the sea, menpora, 2nd period, boro 2, rocket economy.
13/05/2021 09:55;0.0;hampers bansos idulfitri;eid al-fitr social assistance hampers
13/05/2021 10:00;0.0;bom bunuh suruh alih isu korupsi bansos;suicide bomber orders social assistance corruption issue
13/05/2021 10:02;0.0;nyelidiki korupsi bansos sudah tidak berani;investigating social assistance corruption is no longer brave
13/05/2021 10:43;0.0;selamat dana bansos bebas;happy free social assistance funds
13/05/2021 10:45;0.0;singkir staff tangan madam bansos koruptor kakap;get rid of madam bansos corrupt corrupt staff
13/05/2021 10:51;0.0;dendam bro suka kritik dendam evaluasi kerja harun bansos korupsi juga tangkap tangan kpk dinganjuk dukung wna pasca larang mudik lebaran;vengeance, bro, likes to criticize, revenge, work evaluation, aaron, social assistance, corruption, also arrests the kpk, is called to support foreigners after the ban on going home for eid
13/05/2021 11:06;0.0;coba indonesia kemarin korupsi dana bansos;try indonesia yesterday corruption of social assistance funds
13/05/2021 11:06;0.0;tuju koar 2 deh kamu madam bansos hukum anggota 2 partai madam bansos anak lurah lurah karena tidak visi misi bantu lurah visi misi lurah;go to koar 2, you madam social assistance law, member of 2 parties, madam social assistance, the son of the lurah, because you don't have a vision and mission, help the lurah with the vision and mission of the lurah
13/05/2021 11:09;0.0;bansos rakyat miskin korupsi tapi rakyat jelantah kais ngais makan syukur rakyat khatam syukur ngomong menteri dagang menghbau ngurus harga sembako;social assistance for the poor is corrupt, but the people who are used to it are unable to eat, thanksgiving, the people of khatam are grateful to say that the minister of trade has asked to take care of the prices of basic necessities
13/05/2021 11:31;0.0;lagi nangani 75 madam bansos;still handling 75 madam bansos
13/05/2021 11:32;0.0;indonesia jualiri batubara maling bansos;indonesia sells coal thief for social assistance
13/05/2021 11:34;0.0;bansos mane bansos  tanya doang jngn marah;social assistance, social assistance, just ask, don't be angry
13/05/2021 11:37;0.0;enak k rupsi dana bansos;good for social assistance funds
13/05/2021 11:48;0.0;jiwasraya asabri ektapi bansos masak maaf;jiwasraya asabri ektapi cooking social assistance sorry
13/05/2021 12:00;0.0;halah ngapain emosi lucu cebong tutup mata tidak ekspos 1 korupsi bansos 2 7 t2 korupsi jiwasraya 13 t3 korupsi asabri 10 t4 korupsi pelindo ii 6 t5 korupsi kota waringin timur 5 8 t bangsat coba;what is funny emotion cebong closes eyes not exposed 1 social assistance corruption 2 7 t2 jiwasraya corruption 13 t3 asabri corruption 10 t4 pelindo corruption ii 6 t5 east waringin city corruption 5 8 t bastard try
13/05/2021 12:00;0.0;maaf laku alat swab bekas koruptor bansos;sorry for the swab tool used by social assistance corruptors
13/05/2021 12:01;1.0;kepala isi otak pakai mikir bantai dipalestina saudara muslim hak muslim;head, fill your brain, use thinking, slaughter in palestine, muslim brothers, muslim rights
13/05/2021 12:08;0.0;lobster bansos gimana;how about lobster bansos
13/05/2021 12:08;0.0;maksud bong koruptor bansos trilyunan koruptor import benur kepala 2 daerah korup koruptor kakap sp3;the purpose of bong corruptors, social assistance, trillions of corruptors importing fried shrimp, the head of 2 corrupt regions, big corruptors sp3
13/05/2021 12:24;0.0;6 bantu sosial cair cek daftar terima bantu cair diskon pln via bansos bltumkm pkh diskonlistrikpln;6 liquid social assistance check the list receive help liquid discount pln via social assistance bltumkm pkh electricity discount
13/05/2021 12:27;1.0;menko pmk blt dd salur 3 6 juta kpm target 8 juta kpm kabupaten;coordinating minister for pmk blt dd channel 3 6 million kpm target 8 million kpm district
13/05/2021 12:46;0.0;gimana dendam kalau bansos 6trilyun bagi rakyat maling madam senang senang;how about revenge if the social assistance of 6 trillion for the people of the madam thief is happy
13/05/2021 13:13;0.0;nu n muhammadiah sudah gubris madam bansos aman;nu n muhammadiah already gubris madam social assistance is safe
13/05/2021 13:15;0.0;andre kasatgas pimpin tangan duga korupsi bantu sosial bansos covid 19 seret mantan menteri sosial juliari peter batubara muka sidang nonaktif sumber;andre kasatgas leads the charge on suspicion of corruption, social assistance, social assistance, covid 19, drags former social minister juliari peter coal in front of session off source
13/05/2021 13:21;0.0;kabar bansos ngabalin yak;the news of social assistance is back
13/05/2021 13:25;1.0;data terima bansos kuota 15 ribu;data receive 15 thousand quota social assistance
13/05/2021 13:27;0.0;kuat dukung rezim bipang dan bebas dengan leluasa geng madam bansos tuk korupsi hadeuh;strong support the bipang regime and freely freely the social assistance madam gang for corruption
13/05/2021 13:49;0.0;beranijujurpecat salah novel dan kawan-kawan ungkap tangkap kader pdi p bansos;dare to be honest, fire one of the novels and friends reveal the arrest of a cadre of pdi p bansos
13/05/2021 13:50;0.0;barusan juga saya abis debat sama gapercaya covid bansos covid percaya;just now, i just finished a debate with not believing in covid, bansos, believing in covid
13/05/2021 13:55;0.0;dana bansos hak miskin dicuri kabar madam;the social assistance funds for the poor were stolen, madam's news
13/05/2021 13:57;0.0;koruptor pdip semayam bansos miskin;pdip corruptors are like poor social assistance
13/05/2021 14:08;0.0;hmchh bansos;hmchh social assistance
13/05/2021 14:08;8.0;miskin hak curi korupsi bansos;poor right to steal social assistance corruption
13/05/2021 14:12;0.0;kembali dana bansos korupsi;back to the corruption aid fund
13/05/2021 14:13;2.0;duit hasil kentitan bansos semayam;money from social assistance
13/05/2021 14:13;0.0;miskin bansos korup plak sama tugas partai;poor social assistance, corrupt plaque, same as party duty
13/05/2021 14:13;0.0;ngetik juragan bansos;type social assistance skipper
13/05/2021 14:15;1.0;bansos milik miskin embat;social assistance belongs to the poor embat
13/05/2021 14:17;0.0;dana bansos miskin kader pedeipeh sikat;social assistance funds for the poor pedeipeh brush cadres
13/05/2021 14:19;0.0;bansos orang miskin korup tugas partaik;social assistance for the poor, corrupt, the party's task
13/05/2021 14:20;1.0;duit bansos semayam;social assistance money
13/05/2021 14:20;0.0;setan semayam rumah kuntit dana bansos;the devil resides in the house, stalking the social assistance fund
13/05/2021 14:23;0.0;eksploitasi orang miskin cilik karena mudah bodoh tau 2 duit bansos sikat;exploitation of little poor people because it's easy to be stupid, you know 2 brushes of social assistance money
13/05/2021 14:23;0.0;miskin maling bansos;poor social assistance thief
13/05/2021 14:24;10.0;ironis bansos untuk rakyat miskin embat;ironic social assistance for the poor embat
13/05/2021 14:24;399.0;tuhan semayam gubuk miskin bansos semayam rumah 2 serakah;god is like a poor hut, social assistance is like a house 2 greedy
13/05/2021 14:25;0.0;bansos banget;very helpful
13/05/2021 14:26;0.0;bansos ooh bansos;social assistance ooh social assistance
13/05/2021 14:27;0.0;hade goreng aku bansos;hade fried i'm bansos
13/05/2021 14:28;0.0;bansos semayam hati makkk;social assistance in my heart makkk
13/05/2021 14:30;0.0;tuhan semayam gubuk miskinbansos semayam rumah 2 serakah milik terna banteng;god is like a poor hut, social assistance is like a greedy house belonging to a bull breed
13/05/2021 14:34;0.0;woy bansos embat partai losaya tuhan murka kamu dkk;wow, social assistance for the losaya party, god is angry with you and friends
13/05/2021 14:35;7.0;maksud biar miskin hibur lupa dana bansos dapat sudah garong;i mean, so that the poor can be entertained, forgetting that the social assistance funds have been stolen
13/05/2021 14:38;0.0;dana bansos orang miskin gimana;what about the social assistance funds for the poor?
13/05/2021 14:38;0.0;lupa maling dana bansos rakyat miskin partai pdi juang teman teman garong dana bansos;forgot to steal social assistance funds for the poor, the pdi struggle, friends, gang up on social assistance funds
13/05/2021 14:39;0.0;korupsi bansos harun masiku xc3  cku kabar;corruption social assistance harun masiku xc3 cku how are you
13/05/2021 14:40;0.0;bansos miskin triliun embat;trillion embat poor social assistance
