Tanggal;Banyak Retweet;Tweet;Terjemah
15/05/2021 15:43;2.0;tuhan semayam gubuk miskin iblis semayam hati koruptor ambil jatah rakyat miskin korupsi bansos kabar;god resides in the poor hut, the devil resides in the heart of the corrupt, takes the poor people's share of corruption, social assistance news
15/05/2021 15:45;0.0;kowa kowe kowa kowe dana bansos penggal kamu diem saja;kowa kowe kowa kowe the social assistance funds cut you off just shut up
15/05/2021 15:47;0.0;pesan rakyat jelata iblis semayam hati koruptor wabil korupsi dana bansos hak miskinapa kabar madam bansos;the message of the common people, the devil resides in the heart of the corrupt, wabil, corruption, social assistance funds, the rights of the poor, how are you, madam of social assistance
15/05/2021 15:48;0.0;kamu kadrun tahu goblok cie cie cie itu bansos cepat ambil entar duluan kadrun hhhjj tapi maklum kadrun goblok turun;you kadrun know you're an idiot, cie cie cie, social assistance is fast, take it first, kadrun hhhjj but understand that stupid kadrun goes down
15/05/2021 15:54;0.0;percaya 1 tangkap harun masiku 2 tuntas mega korupsi bansos jiwasraya asabri e ktapi 3 usut tuntas partai kuasa 4 laku jujur buka terima kasih;believe 1 arrest harun masiku 2 complete mega corruption of social assistance, jiwasraya asabri e kbut 3 thoroughly investigate power party 4 honest behavior open thank you
15/05/2021 15:59;0.0;dibaikin saking baik ngerasa manusiawi emang seperti  bansos kamu anjirrr fix kamu ketua bansos;it's been repaired so good it feels human, it's like social assistance, you can fix it, you're the head of social assistance
15/05/2021 16:03;2.0;pesan lebaran megawati tuhan semayam gubuk miskinpesan rakyat jelata iblis semayam hati koruptor wabil korupsi dana bansos hak miskinapa kabar madam bansos;message for eid, megawati, god resides in the poor hut, message of the common people, the devil, resides in the heart of the corrupt, wabil, corruption, social assistance funds, the rights of the poor, how are you, madam, social assistance
15/05/2021 16:09;0.0;indonesia pimpin menteri korupsi dana bansos atas;indonesia leads the minister of corruption in the top social assistance funds
15/05/2021 16:09;0.0;mending uang deket tuhandaripada nilep bansos tuhan;it's better to have money close to god than to give god's social assistance
15/05/2021 16:16;0.0;bela cilik bukti bansos tilep listrik materai mudik larang bpjs dana haji tilep tahun ppn ajuuur jum;little defense, proof of social assistance for electric tiles, stamps on going home, bans bpjs, hajj funds, tilep, year vat ajuuur friday
15/05/2021 16:22;0.0;nikmat bipang ambawang paham sok intelek tapi junjung plongo diem saja  cebong tidak goblok tidak makan dana bansos;delicious, bipang ambawang understands that he is intellectual, but respects plongo just shut up, cebong is not stupid, doesn't eat social assistance funds
15/05/2021 16:33;0.0;jangan laden buzerp kais rupiah tweet hasil dana madam bansos;don't be late, buzerp kais rupiah, tweet the results of madam bansos funds
15/05/2021 16:37;1.0;hadeee kotak kamu nyinyirin dana bansos milyaran kabar om;hadee, your box gave billions of social assistance funds, omg
15/05/2021 16:38;0.0;tni polri turun cek rakyat bansos salur sesuai tidak terima ketua pkh setor 10 juta bulan pns bansos;tni polri dropped checks on the people of social assistance channels according to not accepting pkh chairman depositing 10 million a month for social assistance civil servants
15/05/2021 16:41;0.0;pansos woy bansos;social assistance wow social assistance
15/05/2021 16:45;0.0;1965 bunuh duga simpatisan pk i gabisa bukti kalau anggota seperti maen bantai pake catetan nerima bansos pk i rakyat buta huruf gatau kalau partai;1965 kills alleged pk i sympathizers, no evidence that members like to play massacre using a note to receive social assistance from pk i, people are illiterate or not if the party
15/05/2021 16:48;0.0;bansos daerah dapat sardennn;regional social assistance gets sardines
15/05/2021 16:49;0.0;mending jatuh perut anak banding embat bansos tri;it's better to fall in the child's stomach against the tri social assistance
15/05/2021 16:49;0.0;skala daerah smakan dengan skala nasional wooy 6 rbu triliun duit daon belum bunga lagi  maslah dp 0 langusung tnya da sjauh mana program kamu tnya mslah dana bansos;regional school scale with a national scale wooy 6 thousand trillion daon's money no interest yet dp problem 0 directly the question is how far is your program the question is the problem of social assistance funds
15/05/2021 16:52;0.0;sarden bansos;sardines bansos
15/05/2021 17:11;0.0;kalau dana bansos ajar cina juga tidak om;if the social assistance fund teaches china, it's also not om
15/05/2021 17:13;0.0;waduuuh gimana ngiri bos bansos dicuri poseng 2;wow how about sending a social assistance boss stolen by poseng 2
15/05/2021 17:20;0.0;gimana maju pinter bansos rakyat korupsi kolega partai kamu bud;how to be smart about social assistance, people's corruption, your party colleagues, bud
15/05/2021 17:25;0.0;suruh balikin duit nenek kakek aeh duit cebi untuk bayar kalau urus y cebi korupsi alias maling duit bansos rakyat ja embat;tell me to return grandma's money aeh cebi money to pay if you take care of corruption aka stealing people's social assistance money
15/05/2021 17:27;0.0;tidak ingat perang salib kamu tolol makan dana bansos saja kamu buzerp babi dukung sama dukung plongo nikmat babi panggang;don't remember the crusade you're stupid just eat social assistance funds you buzerp pork support and support plongo delicious roast pork
15/05/2021 17:28;0.0;swiper suka nyuri duit bansos;swiper likes to steal social assistance money
15/05/2021 17:35;0.0;bela cilik lemah dana bansos embat;defend the weak and the social assistance funds embat
15/05/2021 17:49;0.0;cair mei 2021 siap cek nama terima bantu sosial 300 ribu terima bantu sosial tunai 300 ribu terima bantu sosial bansos nila 300 ribu;disbursed in may 2021 ready to check names received 300 thousand social assistance received 300 thousand cash social assistance received 300 thousand indigo social assistance social assistance
15/05/2021 17:52;0.0;enak duit bansos bro;good money for social assistance bro
15/05/2021 17:54;0.0;bansos ditilep;social assistance ditilep
15/05/2021 18:02;0.0;kirain ngedata bansos biar sasar korupsi hadeuh;think about collecting social assistance data so you can target corruption
15/05/2021 18:02;1.0;nikmat potong lapis legit mak bansos x om;it's delicious to cut the legit layer, mak bansos x om
15/05/2021 18:03;0.0;sarden bansos wkwk;sardines bansos wkwk
15/05/2021 18:06;1.0;benar lagi korupsi bansos allah tidak ahlak rakyat lagi susah bukan bntu mlh bntua;it's true that god's social assistance corruption is not moral, the people are no longer difficult, not help, help, help
15/05/2021 18:37;0.0;anak sekolah bansos pkh beli buku perlu sekolah;school children social assistance pkh buy books need school
15/05/2021 18:38;0.0;tahun 4x cair dana bansos pkh;year 4x disbursement of social assistance funds pkh
15/05/2021 18:50;0.0;pikir libur ah mikir pas wisata padat ngantri bansos hilang kesan refreshing hehe;i think it's a holiday, i think when the tour is crowded, queuing for social assistance, the refreshing impression is lost hehe
15/05/2021 18:52;0.0;bayar wasit pake dana bansos;pay the referee with social assistance funds
15/05/2021 19:11;0.0;tau kalau daftar bansos daftar yutub baimwong hahaha;you know that if you register for social assistance, sign up for youtube, baimwong hahaha
15/05/2021 19:33;0.0;bekal air cuci kaki tum dana bansos lampau mars astronotnya harun mas;stock of water to wash the feet of tum, the social assistance fund in the past, mars, the astronaut, harun, mas
15/05/2021 19:41;0.0;lulus twk lupa pr 1 harun masiku belum ketemu2 benih lopster3 dan bansos;passed twk forgot pr 1 harun still i haven't found the seeds of lopster3 and social assistance
15/05/2021 19:44;0.0;terima fakta rezim sudah gagal dalam ekonomi belum hukum harun masiku kabur temu juli korupsi bansos infrastruktur gagal total you poor thing now go fuck yourself with a cactus;accept the fact that the regime has failed in the economy, yet the law has not yet been carried out by harun masiku, the meeting in july, corruption, social assistance, infrastructure has failed miserably, you poor thing now go fuck yourself with a cactus
15/05/2021 20:24;0.0;tni polri turun lapang cek rakyat bansos pkh data sesuai tidak;tni polri goes out to check on the people of social assistance, pkh, the data is appropriate or not
15/05/2021 20:26;0.0;berdoe kamu bingung in bingung orang tega dana bansos korup;pray that you are confused and confused, people have the heart to corrupt social assistance funds
15/05/2021 20:45;1.0;salur bansos pkh 2021 tahap keluarga besar rp900 ribu rp3 juta tahun januari april tahap 1 2 tahap 3 laksana lebaran;social assistance channel pkh 2021 big family stage rp900 thousand rp3 million year january april stage 1 2 stage 3 like eid
15/05/2021 20:46;1.0;salur bansos pkh tahap guys kemensos bekerjasama himbara bank bni mandiri bri bank btn;social assistance channel pkh stage guys the ministry of social affairs cooperates with himbara bank bni mandiri bri bank btn
15/05/2021 21:10;0.0;seperti korupsi bansos rakyat susah bamsosnya ditilep;like corruption, the social assistance of the people is difficult to manipulate
15/05/2021 21:16;0.0;juli asyek ini sampai tetangga bansos;july this fun reaches neighbors for social assistance
15/05/2021 21:18;0.0;duit bansos ditilep biar gubuk miskin tetep tuhan pindah rumah konglomerat;the social assistance money is manipulated so that the poor hut will still move to a conglomerate's house
15/05/2021 21:18;1.0;salur bansos pkh 2021 tahap keluarga besar rp900 ribu rp3 juta;social assistance channel pkh 2021 big family stage rp900 thousand rp3 million
15/05/2021 21:18;1.0;salur bansos pkh tahap guys kemensos bekerjasama himbara bank bni mandiri bri ba;social assistance channel pkh stage guys the ministry of social affairs cooperates with himbara bank bni mandiri bri ba
15/05/2021 21:19;1.0;2021 bansos pkh alokasi 10 juta keluarga terima manfaat bantu kurun;2021 social assistance pkh allocation of 10 million families receive period assistance benefits
15/05/2021 21:19;1.0;kemensos batas bantu pkh keluarga hamil ajar lansia disabilitas hitung;ministry of social affairs limits assistance for pregnant families to teach elderly people with disabilities to count
15/05/2021 21:19;1.0;rinciannya hamil 3 000 000anak usia 3 000 000anak sd 900 000 anak smp 1 500 000anak sama 2 000 000lansia;the details are pregnant 3 000 000children aged 3 000 000children up to 900 000 junior high school children 1 500 000children with 2 000 000elderly
15/05/2021 21:27;0.0;corona harus jaga biar bansos alir umur corona;corona must take care so that social assistance flows with the age of corona
15/05/2021 21:32;0.0;serah bagi bansos;hand over to social assistance
15/05/2021 21:46;0.0;ahli politik suara tumpang tindih atur semrawut 1 mudik larang 2 wisata buka 3 wna china bebas 4 dana bansos kantong setan;political experts, overlapping voices, arrange chaotic 1 homecoming forbids 2 open tours 3 chinese foreigners are free 4 social assistance funds in the devil's pocket
15/05/2021 22:10;0.0;1 5 juta orang sangkut orang 2 pilih pangkas populasi manusia dukung beban negara orangnya data beri vaksin bansos uang pajak saya bayar worth it untuk layan ego;1 5 million people involve people 2 choose to cut the human population, support the burden of the country, the data, give vaccines, social assistance, tax money, i pay, it's worth it to serve my ego
15/05/2021 22:10;0.0;bikin surat bansos;make a social assistance letter
15/05/2021 22:10;2.0;tuhan semayam gubuk miskin iblis semayam hati koruptor ambil;god is like a poor hut, the devil is like a corrupt heart, take it
15/05/2021 22:26;0.0;aman om tidak tilep seperti  dana bansos;it's safe, omg, it's not like a social assistance fund
15/05/2021 22:37;1.0;bang covid 19 takut tmpt wisatadugemmalhotel berbintangdn rakyat yahudi lokalcovid 19 berani kemasjidke gerejakesekolahan dan kampus 2dn tmpat 2 yng tidak duitnyasoalnya covid 19 butuh duit bansos raib bangselagi tidak duit bang covid 19 tdk;bang covid 19 is afraid of tourist spots, clubbing star hotels and local jews, covid 19 dares to go to mosques, churches, schools and campuses 2 and 2 that don't have money, the problem is that covid 19 needs money for social assistance, while there is no money, bang, covid 19 doesn't
15/05/2021 22:37;0.0;heleh modus banteng sok suci sok bersih duit bansos garong mingkem saja tuh;heleh, the bull mode is pretentious, it's clean, the social assistance money is illegal, just stay away
15/05/2021 22:43;0.0;korupsi dana bansos brooo hak rakyat korupsi;corruption of social assistance funds brooo the people's right to corruption
15/05/2021 22:48;0.0;ngepush selesai skandal bansos skandal asuransi buka skandal buku merah;push after social assistance scandal insurance scandal opens red book scandal
15/05/2021 22:57;0.0;7 triliun uang bansos kamu korupsi balikin nek mending partai bubar deh bikin hancur negara tipu rampok isi;7 trillion social assistance money, you are corrupt, return it grandma, it's better if the party is disbanded, destroying the country, stealing the contents
15/05/2021 22:57;0.0;jaman sby doi ejek seperti sapi jaman ngecengin kutil bansos ancam penjara;the era of sby doi was ridiculed like a cow in the era of pressing warts, social assistance threatened prison
15/05/2021 22:58;0.0;bansos kemensos 2021 cair mei cek baca;ministry of social assistance for 2021 will be disbursed in may, check, read
15/05/2021 23:25;0.0;semoga proses transparant rawan korupsi bansos motong 10k dikumpulin milyaran;i hope the transparent process is prone to corruption, social assistance cuts 10k and collects billions
15/05/2021 23:41;0.0;setan semayam balik bansos;the devil lies back to social assistance
15/05/2021 23:44;0.0;dana bansos gimana kabar monitoring;social assistance funds how are you monitoring
16/05/2021 00:00;0.0;haha bain partai jargaonya partai cilik garong duit bansos;haha bain party jargaonya small parties steal social assistance money
16/05/2021 00:16;0.0;nganggur 2 sudah nyalahin perintah tar ngarep bansos jg;being unemployed 2 has violated the tar command, hoping for social assistance too
16/05/2021 00:20;0.0;korup bantu bansos bela bunuh mohon jadah tasbeh jari ustat;corrupt helps social assistance to defend killing, please spoil the tasbeh finger of ustat
16/05/2021 00:23;0.0;iya maslahnya ngilang masiku bansos;yes, the problem is that it eliminates social assistance fees
16/05/2021 00:23;0.0;ooo beda yah ternak koruptor korupsi bansos terliunan sistem khalifah anak mantu kuasa waduhhh;ooo, it's different, the livestock of corruptors, corruption, social assistance, the caliphate system of the son-in-law of the power, waduhhh
16/05/2021 00:28;0.0;coped buubaarkaaan satgas covid penjara maling bansos;coped buubaarkaaan covid task force prison thief bansos
16/05/2021 00:45;0.0;dana bansos tidak maling untal korup jadi bancak darat wahana planet mars bilah otak rm padang;the social assistance fund is not a thief to get corrupted to become a land banker, the planet mars vehicle, the brain blade of rm padang
16/05/2021 00:50;0.0;korupsi dana bansos;social assistance fund corruption
16/05/2021 00:52;0.0;jaman korupsi bebas jaman sekarang bansos trilyunan embat rakyat lapar kamu ebong hoker bipang masih bela 2 koruptor dengan alas jaman raja majapahit sudah koruptor;the era of free corruption, today's social assistance, trillions of people are hungry, you ebong hoker bipang still defends 2 corruptors on the basis that the era of the king of majapahit was corrupt
16/05/2021 00:55;0.0;urusin itu koruptor bansos woii banyak teori loe;take care of those corruptors, social assistance, wow, you have a lot of theories
16/05/2021 01:00;0.0;cek terima blt umkm cair mei 2021 bansos tunai 300 ribu bpnt pkh;check received blt umkm liquid in may 2021 cash assistance 300 thousand bpnt pkh
16/05/2021 01:10;0.0;kalau dukung moncong suara bansos korup bansos fakta;if you support the muzzle of the voice of corrupt social assistance, social assistance is a fact
16/05/2021 01:13;0.0;duit bansos miskin rampok tugas partai;social assistance money for the poor robs the party of tasks
16/05/2021 01:22;0.0;tanya bansos mandek juga pungutan liar bupati kader parpol kuasa hsl tes twk bahan curiga sebagai alat lindung sangka 2 tersebut cb prof romli pakai akal sehat bukan perilaku jilat;ask for social assistance stagnated, also illegal regents levies, cadres of political parties with power, hsl test twk suspicious material as a means of protection against suspicion 2, cb prof romli uses common sense, not licking behavior
16/05/2021 01:23;0.0;hidup kritik kerja bang anies padahal daerah banyak gilir kader korupsi bansos n harun masiku kabut smp diem gimana wna negara indonesia ntidak kritik 1 pintu sebar virus;live criticism of work, bang anies, even though the area has many turns for social assistance corruption cadres. harun masku is still foggy in middle school. how does the indonesian citizen not criticize 1 door to spread the virus
16/05/2021 01:33;0.0;dana bansos ditilep mbah;the social assistance fund was stolen mbah
16/05/2021 01:34;0.0;bansos sudah sidang tunggu century ayo dukung;social assistance is in session, waiting for the century, let's support it
16/05/2021 01:38;0.0;maksud gubug bansos;the meaning of social assistance hut
16/05/2021 01:44;0.0;bela lmh bansos;defend lmh social assistance
16/05/2021 01:44;0.0;mohon maaf rezim pelit a yahudi pnh dgr mak kebo nyantunin anak yatim keluarga joker top beli sapi kurban sorry to say yee dana bansos ditilep boro 2 mw nyumbang sumbang dkentit mending nyumbang lwt lembaga 2 independen;sorry for the stingy regime, the jews, pnh, with mak kebo, support the orphans of the joker family, buy sacrificial cows, sorry to say yes, the social assistance fund was ditilep boro 2 mw donated donated dkentit better donate through 2 independent institutions
16/05/2021 01:47;0.0;pilpres rayu rayu suara umat islam dengan politik sarung aku bangkrut nkri bantu bansos karya harun masiku lebaran;presidential election wooing the voices of muslims with sarong politics i'm bankrupt nkri help social assistance by harun masiku for eid
16/05/2021 02:00;0.0;2 bodoh manfaat serap tenaga kerja daya beli turun bansos ngalir tidak sasar lagi gile utang negara gt  manipulasi data ya;2 stupid benefits of absorption of labor, purchasing power goes down, social assistance flows, no longer targeting state debt, gt data manipulation, right?
16/05/2021 02:07;0.0;makan bansos saja enak dapat gaji hasil tweet doank buzerp;it's just good to eat social assistance, it's good to get a salary from tweets only buzzer
16/05/2021 02:08;0.0;hapus bansos dana covid ampuh tanggulang covid negara lawak;abolishing the social assistance fund covid is effective in dealing with covid the country of jokes
16/05/2021 02:10;0.0;diam free rider apakabar benur madam bansos diam tanda tuju singkir ksatria 75 u r all nothing but kacung;silent free rider apakabar benur madam bansos silence sign go get rid of knight 75 ur all nothing but kacung
16/05/2021 02:15;0.0;btw emang sarden bansos itu aneh banget merk as4hi g4g4 jdi bansos mesti kasih bumbu biar enak;btw, the social assistance sardines are really weird, the as4hi g4g4 brand, so social assistance must add seasoning to make it delicious
16/05/2021 02:19;0.0;yampun pack sabar tar bansos nyusul;sorry pack, be patient, the social assistance will follow
16/05/2021 02:24;0.0;kalau duit bansos semayam;if the social assistance money stays
16/05/2021 02:24;0.0;mbah mega jual miskin gilir kader dapat pos menteri sosial duit bansos ditilep kader panjenengan surem;ms. mega sells poor cadres in turns to get the post of minister of social affairs, social assistance money is tricked by cadres, panjenengan surem
16/05/2021 02:40;1.0;mostpop perintah lanjut bantu sosial bansos bantu sosial tunai bst 300 ribu program keluarga harap pkh;mostpop further orders social assistance social assistance cash social assistance bst 300 thousand family programs please pkh
16/05/2021 02:42;0.0;tolak lupa dana bansos n madam 6 laskar fpiyg jangan hilang sudah tenggelam badai corona;refuse to forget the social assistance funds n madam 6 fpiy troops that don't disappear, the corona storm has sunk
16/05/2021 02:43;0.0;cek berita bansos pkh;check pkh social assistance news
16/05/2021 02:45;;jiaaah perek pesek eks ini duit bansos hasil ngerampok;jiaaah this ex pug bastard money is the result of the robbery
16/05/2021 02:51;0.0;ustad nama asal pimpin pondok nonton koran baca tv pdip bela lemah bansos sikat habis kamu tad;ustad, original name, led the cottage, watched the newspaper, read tv, pdip, defended the weakness of social assistance, brushed it off earlier
16/05/2021 02:56;2.0;beri bansos pkh bg keluarga terima manfaat bantu keluarga miskin dampak pandemi dalam penuh keb;give pkh social assistance for families to receive benefits to help poor families impacted by the pandemic in full kindness
16/05/2021 02:59;0.0;emak bansos aman ya tunggu rezim kelar emak kandangin;mother of social assistance is safe, wait for the regime to finish, mother of the cage
16/05/2021 03:01;0.0;duit bansos ceban ditilep sama jabat;ceban's social assistance money is tricked by the office
16/05/2021 03:03;0.0;bantu preaiden pake tas bansos kemarin;help preaiden using the social assistance bag yesterday
16/05/2021 03:03;0.0;iya kak manfaat bansos pkh;yes sis the benefits of social assistance pkh
16/05/2021 03:04;0.0;iya bu alhamdulillah banget bansos pkh cair 2021;yes, ma'am, thank god the social assistance has been liquidated in 2021
16/05/2021 03:04;0.0;setan semayam curi duit bansos;the devil is stealing social assistance money
16/05/2021 03:05;0.0;iya mba bansos pkh manfaat banget bg terima;yes mba social assistance pkh very useful thank you
16/05/2021 03:05;0.0;sudah seperti  korupsi dana bansos;it's like corruption in social assistance funds
16/05/2021 03:06;0.0;iya benar banget mba sangat bantu bansos pkh;yes, it's really true, ma'am, it's really helpful for social assistance pkh
16/05/2021 03:07;0.0;iya benar bansos pkh sudah cair april 2021;yes it is true that the pkh social assistance has been disbursed in april 2021
16/05/2021 03:07;0.0;kuuuy simak deh mba lid biar paham bansos pkh;i'll have to watch, ms. lid, so i can understand the social assistance pkh
16/05/2021 03:08;0.0;iya benar mba bansos pkh bantu banget untuk keluarga terima manfaat;yes, it's true, ms. bansos pkh is really helpful for the family, thanks for the benefits
16/05/2021 03:09;0.0;yoi mba git biar banyak tau tentang bansos pkh;yoi mba git let me know more about social assistance pkh
16/05/2021 03:16;0.0;yahudi pesek duit darimana kalau tidak duot rampok bansos;where does the snub jew come from if not the duo rob social assistance
16/05/2021 03:17;0.0;ooh alas uang bansos ditilep guys ibuknya ken rumah miskin dideketin tuhan miskin sebenernya ibuknya sayang banget guys;ooh, the social assistance money was ditilep, guys, his mother went to a poor house near a poor god, actually his mother really loves him guys
16/05/2021 03:17;0.0;itu komen tetangga jarah pulang bawa kulkas bisa bawa pulang hasil jarah bangga beri anak n cucu kalau miskin terima bansos n kjp 2;that's the neighbor's comment, looting home, bringing a refrigerator, can take home the loot, be proud to give children and grandchildren, if poor, receive social assistance n kjp 2
16/05/2021 03:20;0.0;coba korupsi bansos asabri jiwasraya bpjs ketenagakerjaan buat rugi rakyat negara hukum untuk koruptor tersebut pastaskah pimpin tidak adil untuk proses hukum nanya doank;try corruption, social assistance, asabri jiwasraya, employment bpjs, for the loss of the people of the state, the law for these corruptors, is it unfair to lead the legal process, ask
16/05/2021 03:25;0.0;bansos garong buktipede ipeh partai licik;social assistance undermines the evidence of a sneaky party ipeh
16/05/2021 03:26;0.0;kalau klaim bela cilik harusnya dana bansos tidak korupsi jaring begundal lapang kerja isi rakyat ri isi wn cina weh 2 pie;if you claim to defend a child, the social assistance fund should not be corrupt, the nets of field thugs will work, fill in the people of indonesia, fill in the chinese wn, weh 2 pie
16/05/2021 03:29;0.0;sesuai judul ntar kantong bansos terima terima bantu terima bangke kantong doang mensos kamu tidak baca emg kantong doang isi beli;according to the title later, the social assistance bag accepts thank you help accept bangke it's just a social assistance bag, you don't read it, it's just the contents of the bag to buy
16/05/2021 03:32;0.0;izin putar bansos untuk kartu atm bantu pkh hak pegang terima bantu tugas damping kec ngronggot nganjuk atm  pegang damping terima kasih;permission to play social assistance for atm cards, help pkh, hold rights, thank you, help with duties
16/05/2021 03:38;0.0;hukum mati itu laku menteri kemarin korup bansos benar 2 nurani gila;the death penalty was carried out by the minister yesterday, corrupt, social assistance, true 2 crazy consciences
16/05/2021 03:48;0.0;saya bagi bansos 600t 7 mulud  seep aku munding;i'm giving 600t 7 social assistance, seep i'm thinking
16/05/2021 03:50;0.0;bansos coreng hina president;social assistance smudges insults the president
16/05/2021 03:50;0.0;bos ntidak becus kerja awas gembor gembor jebol itu korupsi bansos korupsi kalau pimpin malu mundur nyalahin anak;boss is incompetent at work, watch out for bursts of bullshit, corruption, social assistance, corruption, if the leader is ashamed to step down, blame the child
