Tanggal;Banyak Retweet;Tweet;Terjemah
15/05/2021 02:26;0.0;mungkin dana palestine gede bansos mknya  4astagfirullah halaziim;maybe the palestine fund is big for social assistance mknya 4astagfirullah halaziim
15/05/2021 02:27;0.0;cek terima  bansos  pkh 1 web klik lihat cari data terima bantu sosial tunai bst belah kiri pilih id id nik id dtks nomor pbi jika kis;check receive social assistance pkh 1 web click view find data receive cash social assistance bst left side select id id nik id dtks pbi number if kis
15/05/2021 02:35;0.0;serang penjuru pakai lempari pasir gitu pakai alutsista biaya ratus triliun hidup sumbang bansos makan biaya nyerang;attack the corners by throwing sand, so using defense equipment costs hundreds of trillions of lives, donating social assistance, eats the cost of attacking
15/05/2021 02:36;0.0;mohon maaf tidak terima keluh putar kerja alias timbangane bansos mu cairno iki modyar kon;i'm sorry i don't accept complaints about turning work, aka your social assistance scale, cairno, modyar kon
15/05/2021 02:43;0.0;bansos garong 2 garong miskin jauh tuhan;social assistance robs 2 of the poor far away, god
15/05/2021 02:51;0.0;kalau buat kasih bansos hasil korupsi hasil monopoli hasil buat kriminal bagaimana ustad mahfud apakah baik;if you give social assistance, the results of corruption are the results of monopoly proceeds for criminals, how about ustad mahfud, is it good?
15/05/2021 02:53;0.0;mam sabi tukeran bansos;mam sabi exchange social assistance
15/05/2021 02:54;0.0;bansos kamu abin saja han;your social assistance just abin han
15/05/2021 02:56;0.0;ayok pakek pcx warna hitam mu hasil gelap dana bansos;let's use your black pcx, the results are dark from social assistance funds
15/05/2021 03:13;0.0;koruptor bansos lulus kampus negeri;social assistance corruptors graduate from state universities
15/05/2021 03:15;0.0;madam ingat bansos;madam remembers social assistance
15/05/2021 03:17;0.0;hahaha sayang rakyat sayang duit puyeng bayar tenaga kesehatan bansos dapat pajak dki turun logika kalau mau bela bilang sayang rakyat tidak sayang rakyat rakyat nganggur koq;hahaha it's a pity the people love the money, they have to pay for the social assistance health workers, get the dki tax, it's logical if you want to defend it, say it's a pity the people don't love the people, why are the people unemployed?
15/05/2021 03:19;0.0;dapet bansos pergi wisata malu boro-boro mikir wisata mikir makan susah;get social assistance to go on a tour, shame it's a waste to think about travel, think about eating hard
15/05/2021 03:21;0.0;bansos pkh manfaat banget ramadan puasa keluar apalagi bikin cemilan goreng;social assistance pkh is very beneficial for fasting, let alone making fried snacks
15/05/2021 03:21;1.0;perintah lanjut bantu sosial bansos bantu sosial tunai bst 300 ribu prog;further orders social assistance social assistance cash social assistance bst 300 thousand programs
15/05/2021 03:28;0.0;tren naik harga sembako pasar bansos pkh topang masyarakat butuh;an upward trend in the price of basic necessities in the social assistance market, supporting the community in need
15/05/2021 03:29;0.0;sih emak rasa ini sejak puasa harga sayur butuh dapur lumayan tinggi bansos pkh bantu kuat daya beli keluarga pasti;i think that since fasting, vegetable prices need a fairly high kitchen, pkh social assistance helps the family's purchasing power for sure
15/05/2021 03:30;0.0;harun masiku hati malaikatrakyat kado istimewa dana bansos;harun masiku, the heart of an angel, the people, a special gift from the social assistance fund
15/05/2021 03:31;0.0;bansos pkh jatuh ramadan lega keluarga pelosok tanah air karena ringan beban keluar;social assistance pkh falls ramadan is a relief for families in remote areas of the country because the burden is light
15/05/2021 03:34;0.0;kabar bansos jiwasraya asabri bpjs ketenagakerjaan tangan kasus semoga berani untuk tangkap libat;news on social assistance, jiwasraya, asabri, bpjs, employment, hands, cases
15/05/2021 03:36;0.0;naif buta tuli tumpul otak duit bansos korupsi asal hutang tidak baca berita tjoko;naive, blind, deaf, dull, brain, money, social assistance, corruption, from debt, don't read the news, tjoko
15/05/2021 03:37;0.0;cair bansos pkh kuatir selain bank cair e-warong;liquid social assistance pkh worried other than e-warong liquid bank
15/05/2021 03:38;0.0;hahaha jatah bansos korup padahal jatah miskin itu saking rakus takut miskin gitu;hahaha the social assistance quota is corrupt even though the poor are so greedy that they are afraid of being poor
15/05/2021 03:39;0.0;realisasi 1 bansos 2 1 juta bulananda berani nanya;the realization of 1 social assistance 2 1 million months, you dare to ask
15/05/2021 03:40;0.0;didik concern perintah jokowi pkh ini harap proses ajar jalan bansos komponen didik;educate concerns about jokowi pkh's order, i hope the teaching process for the social assistance component is taught
15/05/2021 03:41;0.0;ini bansos pkh balita jadi balita terima 2 anak saja kan butuh yaaa;this is social assistance for toddlers, so toddlers only accept 2 children, right, you need it
15/05/2021 03:42;0.0;program curi bansos;social assistance stealing program
15/05/2021 03:43;0.0;tidak kerja bansos;don't work for social assistance
15/05/2021 03:43;0.0;teman bansos pkh kasih daftar bantu yaa;pkh social assistance friends, please help register
15/05/2021 03:44;0.0;benar banget lehih bagi butuh jadi bansos pkh sasar;it's really really good for those who need to be social assistance, especially if they're targeted
15/05/2021 03:47;0.0;ente kalau mobil jalan tol bro kalau pesawat bandara 2 bikin bandara tapi fasilitas kamu tidak uang bagi kpada rakyat dalam bentuk bansos bantu;you, if the car goes toll, bro, if the airport plane 2 builds an airport, but your facilities don't give money to the people in the form of social assistance
15/05/2021 03:53;1.0;kismin seperti  gimana kismin seperti  tukang curi dana bansos allah murka;kismin is like how kismin is like a thief who steals social assistance funds, allah is angry
15/05/2021 03:53;0.0;sidang bansos covid 19 jabat kemensos saya terima sepeda brompton;the social assistance trial covid 19 holding the ministry of social affairs i received a brompton bicycle
15/05/2021 03:54;0.0;nyambung ini banyak baca harun masiku duga smp sekjen bansos dalam adil smp ketua kondisi dpr pdip hubung sama partai wooiii individu jabat pdip kacau nih;this link reads a lot harun masiku guess middle school secretary general for social assistance in fair junior high school chairman pdip condition dpr liaise with party wooiii individual pdip position messed up
15/05/2021 03:59;0.0;bicara orang miskin bansos untuk orang miskin tilap parpol diam;talk to the poor, social assistance for the poor, keep political parties silent
15/05/2021 04:02;0.0;gubuk bansos;social assistance hut
15/05/2021 04:06;0.0;modus bansos;social assistance mode
15/05/2021 04:08;0.0;bansos palak curi sih kesan ngumpet 2 takut gerombol bancaan tedeng aleng 2 istilah keren tsm gitu lho;bansos palak steals the impression of hiding 2 afraid of gangs of bancaan tedeng aleng 2 cool terms, tsm like that, you know
15/05/2021 04:08;0.0;korupsi bansos ketua kondisi dpr pdip;corruption of social assistance, chairman of the condition of the pdip dpr
15/05/2021 04:09;0.0;2 madam bansos sholat pas sholat lebaran dipamerin;2 madam of social assistance praying at eid prayers being exhibited
15/05/2021 04:10;2.0;siang tweeps gimana suasana lebaran mohon maaf lahir batin senang raya lebaran suka cita bansos program keluarga harap pkh perintah cair dana dampak pandemi;afternoon, tweeps, how is the atmosphere of eid, sorry to be born and inner heart, happy eid, joy of social assistance, family program, please pkh orders to disburse funds from the impact of the pandemic
15/05/2021 04:11;0.0;wkwkwkwk segitunya tadz ingat umur itu bansos embat gimana tanggap nya;wkwkwkwk that's like that tadz remember that age is a long social assistance, how do you respond
15/05/2021 04:17;0.0;hahaha madam bansos apes niat citra dilecehin syukurin;hahaha madam bansos sadly the intention of the image is abused thank you
15/05/2021 04:19;0.0;nazis tralala jakarta beranta bansos;nazis tralala jakarta with social assistance
15/05/2021 04:24;0.0;malaikat ngetit duit bansos;angel sucks social assistance money
15/05/2021 04:28;0.0;perang kirim tka narkoba prostitusi koruptor kardus duren dangdut maling bansos kuasa lahan utang timbul rusa korban rakyat;war sends foreign workers drugs prostitution corruptors cardboard duren dangdut maling social assistance land rights debt arises deer victims of the people
15/05/2021 04:35;0.0;cair bansos pkh bank himpun negara himbara;disbursed social assistance pkh bank collects himbara country
15/05/2021 04:38;0.0;yee kaum bipang ingat duit bansos duit hasil pajak rakyat kalau perintah pelit duit hasil ngutang terus korupsi;yes, the bipang remember that the social assistance money is the money from the people's taxes, if the order is stingy, the money from debt continues to be corrupt
15/05/2021 04:45;0.0;lockdown perintah nanggung biaya hidup bantu turun sunat trima keluarga 4 orang ngaku 6 bukti data ganda terima bansos potong duit bansos tingkat;lockdown orders to bear living expenses to help with circumcision accepts family of 4 people confess 6 double data proofs receive social assistance cut social assistance money
15/05/2021 04:47;0.0;kandang banteng semayam maling bansos semayam;the bull cage in semayam
15/05/2021 04:50;0.0;duit emak kamu tong kamu tau tidak duit bansos jiwasraya asabri duit negara;your mother's money, don't you know, jiwasraya asabri's social assistance money is state money
15/05/2021 04:57;0.0;cak gibran kumpul bansos palestina tekan perintah pusat kirim pasu palestina;cak gibran gathers palestinian social assistance, presses the command center to send palestinian troops
15/05/2021 04:58;0.0;salur bansos 2021 tahap keluarga besar rp900 ribu rp3 juta tahun januari april tahap 1 2 tahap 3 laksana lebaran;social assistance channel 2021 large family stage rp900 thousand rp3 million january april stage 1 2 stage 3 like eid
15/05/2021 04:59;0.0;salur bansos kemensos bekerjasama himbara bank bni mandiri bri bank btn;social assistance channel of the ministry of social affairs in collaboration with himbara bank bni mandiri bri bank btn
15/05/2021 05:00;0.0;sunat jatah miskin bansos jatah madam bebas potong;circumcision rations for the poor, madam's allowance, free cut
15/05/2021 05:05;0.0;3 varian memperlihatkan varian bansos bisa sesak ekonomi rakyat 2020 pasca lebaran tidak lupa dagang siksa regulasi bont pkh bansos ngawur;3 variants show that the social assistance variant can be stifled by the people's economy in 2020, after eid, don't forget to trade the punishment for the regulation of social assistance bonuses, which is inconsequential
15/05/2021 05:07;0.0;negara wakanda dok ambil dana bansos miskin sampai berm dok;wakanda country, doc, take social assistance funds for the poor to make money
15/05/2021 05:08;0.0;berkah lebaran blt umkm rp1 2 juta cair ayo poin cek;the blessing of eid blt umkm rp1 2 million liquid let's check points
15/05/2021 05:08;0.0;kalau anggota masyarakat korupsi dana bansos;if members of the public corrupt the social assistance funds
15/05/2021 05:09;0.0;lockdown bansos sunat lockdown;lockdown bansos circumcision lockdown
15/05/2021 05:12;1.0;tidak anggar perintah untuk salur bansos pkh tahap ii 6 53 triliun semoga sasar;did not take the order to channel social assistance pkh stage ii 6 53 trillion hopefully target
15/05/2021 05:14;0.0;2021 bansos pkh alokasi 10 juta keluarga terima manfaat bantu kurun bantu triwulan januari april juli oktober;2021 social assistance pkh allocation of 10 million families receive assistance during the quarterly assistance period january april july october
15/05/2021 05:15;0.0;semoga salur bansos pkh jalan lancar sesuai sasar hari raya riang gembira lapis masyarakat;i hope the social assistance channel pkh goes smoothly according to the target of the happy and cheerful holiday of the community
15/05/2021 05:15;0.0;rinciannya hamil 3 000 000anak usia 3 000 000anak sd 900 000 anak smp 1 500 000anak sama 2 000 000lansia 70 2 400 000disabilitas 2 400 000sumber;the details are pregnant 3 000 000children aged 3 000 000children up to 900 000 children in junior high school 1 500 000children with 2 000 000 elderly 70 2 400 000disability 2 400 000source
15/05/2021 05:15;0.0;wajar masyarakat bangkang perintah perihal protokol sehat covid 19 sadar masyarakat tingkah busuk oknum petinggi bikin masyarakat bodo atur korupsi dana bansos alat antigen bekas;it's natural for people to be disobedient to order covid-19 healthy protocols. people are aware of the rotten behavior of high-ranking officials, making people stupid to regulate corruption in social assistance funds for used antigen devices.
15/05/2021 05:16;0.0;saya tarik ngomongin anak lurah curi dana bansos;i withdraw talking about the village head's son stealing social assistance funds
15/05/2021 05:17;1.0;belum tentang informasi bansos pkh perintah menggelontarkan anggar dana untuk bantu masyarakat dampak pandemi satu sasar terima pkh program keluarga harap;not yet about information on social assistance pkh orders to release budget funds to help the community impact of the pandemic one target is to accept the family program pkh please
15/05/2021 05:17;0.0;kemensos batas bantu pkh keluarga hamil ajar lansia disabilitas hitung bansos pkh batas maksimal 4 orang dalam keluarga batas hitung cantum sk direktur jamin sosial keluarga indeks bansos;ministry of social affairs limits on assistance for pkh pregnant families teaching elderly people with disabilities calculating social assistance pkh maximum limit of 4 people in the family counting limits include decrees for the director of family social security social assistance index
15/05/2021 05:18;0.0;2021 salur bansos lanjut apbn 2021 siap anggar rp110 triliun terima  jokowi  saat luncur bantu tunai 2021 se-indonesia istana negara jakarta senin 4 januari 2021;2021 further distribution of social assistance funds 2021 state budget ready to budget rp110 trillion to receive jokowi at launch for 2021 cash assistance throughout indonesia state palace jakarta monday 4 january 2021
15/05/2021 05:19;0.0;pkh terap 2007 sebagai upaya cepat tanggulang miskin bansos pkh juga program kemensos dalam bantu juta keluarga dampak covid 19;the 2007 pkh was implemented as a quick effort to tackle the poor in social assistance, the pkh was also a program from the ministry of social affairs in helping millions of families affected by covid 19
15/05/2021 05:21;0.0;mensos beri bansos sasar 9 juta keluarga terima manfaat pkh sebar pelosok tanah air semoga masyarakat lapis rasa hari raya dengan suka cita;social minister provides social assistance targeting 9 million families to receive benefits from pkh spread throughout the country, hopefully the people of all layers of society feel that the holidays are happy
15/05/2021 05:22;1.0;ecek nama terima bansos pkh tahap ii april 2021 cek laman;check the name of receiving social assistance pkh stage ii april 2021 check the page
15/05/2021 05:25;1.0;cair dana bansos pkh kemensos dengan himbara untuk salur bansos rekening 2 kpm pkh;disbursed social assistance funds from the ministry of social affairs with himbara to channel social assistance accounts for 2 kpm pkh accounts
15/05/2021 05:34;0.0;malaikat curi bansos yah malaikat bro;angel steals social assistance, angel bro
15/05/2021 05:36;1.0;benar lagi korupsi bansos allah tidak ahlak rakyat lagi susah bukan bntu mlh bntuan sunat tidak empati skli;it's true that god's social assistance corruption is not moral, the people are no longer difficult, not help, circumcision assistance, no empathy
15/05/2021 05:37;1.0;belum tentang informasi bansos pkh perintah menggelontarkan anggar dana untuk bantu masyarakat terda;not yet about information on social assistance pkh orders to release budget funds to help local communities
15/05/2021 05:37;1.0;ecek nama terima bansos pkh tahap ii april 2021 cek laman https;check the name of receiving social assistance pkh stage ii april 2021 check the https page
15/05/2021 05:37;1.0;tidak anggar perintah untuk salur bansos pkh tahap ii 6 53 triliun s;failed to comply with the order for the distribution of social assistance at pkh stage ii 6 53 trillion s
15/05/2021 05:38;1.0;cair dana bansos pkh kemensos dengan himbara untuk salur bansos rekening;disburse social assistance funds from the ministry of social affairs with himbara for channeling social assistance accounts
15/05/2021 05:41;0.0;madam korupsi bansos ketua bebas;madam corruption, social assistance, free chairman
15/05/2021 05:44;0.0;menteri uang suahasil nazara bansos cepat salur program keluarga harap pkh harap semoga salur jalan lancar bantu keluarga pandemi aamiin;minister of finance, suahasil nazara, social assistance, quickly distributes family programs, hope pkh, i hope that the distribution of roads goes smoothly, helping the families of the pandemic, amen
15/05/2021 05:45;0.0;dukung bansos rakyat semoga tidak kotupsi;support the people's social assistance, hopefully there will be no corruption
15/05/2021 05:49;0.0;kalau sudah tau gitu pesan kader korupsi bansos untuk miskin citra;if you already know that, the message for social assistance corruption cadres is for poor image
15/05/2021 05:51;0.0;hai seleb bansos;hi social celebrity
15/05/2021 05:53;0.0;dukung bansos rakyat semoga tidak korulsi;support the people's social assistance, hopefully there will be no corruption
15/05/2021 05:54;;tolak prubahan bijak 2kan perintah kait covid 19 smkn ms justeru panjang situasi pandemi  ;refuse wise changes, the command to hook covid 19 smkn ms, the pandemic situation takes a long time 
15/05/2021 05:54;2.0;tuhan semayam gubuk miskin justeru partai garda depan mangsa uang bansos untuk orang miskin nenek keliru fakta kader partai semayam cari makan gubuk orang miskin tuhan;god, the poor hut, the vanguard party, preys on the social assistance money for the poor, the grandmother is wrong, the fact that the seyamyam party cadres are looking for food for the poor people's huts, god
15/05/2021 05:57;0.0;ulang sampai bansos habis;repeat until the bansos run out
15/05/2021 05:58;3.0;negeri wakanda bani bipang koar koar dimedsos radikal radikul curi bansos n banyakin utang;wakanda country bani bipang koar koar social media radical radikul steal social assistance n increase debt
15/05/2021 06:03;0.0;sebut madam madam bansos tangkap;call madam madam bansos catch
15/05/2021 06:04;0.0;dukung bansos rakyat semoga tidak adabkorupsi;support the people's social assistance, hopefully there will be no corruption
15/05/2021 06:04;0.0;rezeki koruptor dana bansos asik kasus siapa 3 seperti edy tansil;sustenance for corruptors from social assistance funds is cool, who are the 3 cases like edy tansil
15/05/2021 06:09;0.0;tukang curi bansos anal buang kelaot;anal social aid thief throws away
15/05/2021 06:13;0.0;rakyat nu muhammadiah sudah gubris navel baswedan dan kawan-kawan ttapi pecat madam bansos selamat;the people of nu muhammadiah have taken care of navel baswedan and his friends but fired madam bansos safely
15/05/2021 06:14;0.0;ko malaikat curi duit bansos sambil ngupil;why did the angel steal the social assistance money while picking his nose
15/05/2021 06:22;2.0;tuhan semayam gubuk miskin justeru partai garda depan mangsa uang bansos ut;god is like a poor hut, instead, the vanguard party is the victim of the social assistance money ut
15/05/2021 06:25;0.0;bansos nuri;parrot social assistance
15/05/2021 06:29;242.0;tidak heran indonesia bela jajah israel karena virtue ethic tidak bentuk dengan baik jangan thd palestina thd indonesia empatynya bukti dana bansos anggar korupsi jabat pakai upeti;no wonder indonesia defends israel's colony because virtue ethics is not well shaped, don't attack palestine against indonesia, empathy, evidence of social assistance funds fencing corruption, shake hands with tribute
15/05/2021 06:30;0.0;andai bansos covid 19 bangun fisik mangkrak tulang tega sadis tulang untuk rakyat makan lempar lempar;if the social assistance covid 19 woke up physically, the bones would be sadistic for the people to eat throwing and throwing
15/05/2021 06:30;0.0;benar banget saya percaya pedeih emang bela cilik dengan gesit kader  8ngamanin dana bansos unt cilik cekat;it's true, i believe that pedeih really defends the little ones swiftly, cadres, and secures social assistance funds for the young
15/05/2021 06:30;242.0;tidak heran indonesia bela jajah israel karena virtue ethic tidak bentuk dg;no wonder indonesia defended israel's colony because virtue ethic was not formed with
15/05/2021 06:33;14.0;suka bela jajah kualitas empati dengan korupsi bansos;likes to fight for the quality of empathy with social assistance corruption
15/05/2021 06:34;0.0;dukung bansos rakyat semoha tidak korupsi;support the people's social assistance, hopefully there will be no corruption
15/05/2021 06:35;1.0;emaknya bilang tuhan rumah 2 miskin bansos garong rakyat miskin merana;his mother said that the god of the poor house, social assistance, robbed the poor people languishing
15/05/2021 06:41;0.0;anggota partai kuasa maling duit bansos trilyunan teriak radikal-radikul pancasila uud 45;"members of the power party stealing billions of social assistance money shouted radicals of pancasila uud 45 """
15/05/2021 06:47;0.0;madam du lawan bansos;madam du against social assistance
15/05/2021 06:50;0.0;gilir peduli banget rakyat korban gilir bansos rakyat korupsi kamu mingkem;it's time to really care about the people who are victims of social assistance, the people of corruption, you stay away
15/05/2021 06:52;0.0;cuan bray bansos ditilep yekaann;cuan bray bansos is tiled
15/05/2021 06:57;0.0;salur bansos tunai tambah;additional cash assistance channel
15/05/2021 07:10;0.0;seperti juliari bansos coba kalau kpk kuat berani periksa proyek strategis pemth triliun;like juliari bansos try if kpk is strong dare to check the strategic project of pemth trillion
15/05/2021 07:25;3.0;bagi bansos blt dds mei desa banding kintamani kpm 190;for social assistance blt dds may village appeal kintamani kpm 190
15/05/2021 07:25;0.0;hadew emang bunda empatikalau empati mencuri bansos didiemin baebtw pemrintah patai;hadew, indeed, an empathetic mother, if empathy steals social assistance, it is ignored by the patai government
15/05/2021 07:29;0.0;bansos sesuai harap perintah;social assistance according to the order
15/05/2021 07:35;0.0;mencuri bansos  ngaca;stealing social assistance
15/05/2021 07:40;0.0;hi teman tengah pandemi masyarakat dampak beri bansos perintah tunggu masyarakat sih bansos pkh 2021 gimana ngecek a thread;hi friends, in the middle of a community pandemic, the impact of giving social assistance orders is waiting for the community, social assistance pkh 2021, how to check a thread
15/05/2021 07:40;0.0;madam bansos tepat;madam bansos right
15/05/2021 07:44;0.0;rameee yahh  ini masyarakat aparatur nyayang neng bansos;rameee, well, this is an apparatus community who loves social assistance
15/05/2021 07:47;0.0;tetangga saudara teman terima bansos perintah program keluarga harap pkh teman bantu cek website kemensos;neighbors, friends, receive social assistance, family program orders, please pkh friends to help check the ministry of social affairs website
15/05/2021 07:49;0.0;madam bansos ki lurah harun masiku mana semayam;madam bansos, where is the village head, harun masiku?
15/05/2021 07:53;0.0;april kemarin perintah menteri sosial salur bansos tunai program keluarga harap rp6 53 triliun;last april, the minister of social affairs ordered the distribution of cash assistance for the family program, please idr 653 trillion
15/05/2021 07:54;0.0;kabar gembira salur bansos tunai tambah;good news for additional cash assistance channels
15/05/2021 07:54;0.0;perintah harap cair bansos program keluarga harap bantu cepat pulih ekonomi akibat pandemi;the order to disburse the social assistance program for the family, please help the economy recover quickly due to the pandemic
15/05/2021 07:56;0.0;terima bansos program keluarga harap sebar seluruh pelosok tanah air bener-benar butuh;thank you for the family program social assistance, please spread it to all corners of the country, really need it
15/05/2021 07:58;0.0;beri bansos sasar 9 074 584 keluarga terima manfaat semoga pkh masyarakat bantu;give targeted social assistance 9 074 584 families receive benefits, hopefully the community will help
15/05/2021 07:59;0.0;agama patok kitab sebagai tuntun menyebut nama tuhan ucapan serius diperjuangkan tegas bahwa salah salah benar benar habib ulama guru kami dalam islam habib bukan makan duit bansos;the religion of the book, as a guide to mentioning the name of god, serious speech, firmly fought for, that it is wrong, it is true, habib, ulema, our teacher in islam, habib does not eat social assistance money
15/05/2021 07:59;0.0;suka proses salur bansos rekening kpm pkh semoga tidak kendala proses cair nya;i like the process of channeling social assistance to the kpm pkh account, hopefully there won't be any problems with the liquidation process
15/05/2021 08:01;0.0;koruptor partai juara korupsi pdip bansos bejibun;corruption champion party corruption pdip bansos bejibun
15/05/2021 08:02;0.0;saya lebih tuju sih tumbuh ekonomi sulit kalau pendduknya buat sempat kerja jangan jkt mulu terima kerja anak 2 muda jkt bth bansos anak 2 muda jkt bth kerja jangan anggap sepele anggur jkt;i'm more focused on growing the economy, it's difficult if the population has time to work, don't always accept the work of 2 young people jkt bth social assistance for 2 young people jkt bth work don't take wine jkt lightly
